Understanding Customer Satisfaction With Services by Leveraging Big Data - The Role of Services Attributes and Consumers&apos; Cultural Background.,IEEE Access
Arabic Natural Language Processing and Machine Learning-Based Systems.,IEEE Access
A Review of Sparse Recovery Algorithms.,IEEE Access
Improvement of 60 GHz Transparent Patch Antenna Array Performance Through Specific Double-Sided Micrometric Mesh Metal Technology.,IEEE Access
Frontal-Sagittal Dynamic Coupling in the Optimal Design of a Passive Bipedal Walker.,IEEE Access
Security-Enhanced SC-FDMA Transmissions Using Temporal Artificial-Noise and Secret Key Aided Schemes.,IEEE Access
360° Semantic File System - Augmented Directory Navigation for Nonhierarchical Retrieval of Files.,IEEE Access
Robust Authentication of Consumables With Extrinsic Tags and Chemical Fingerprinting.,IEEE Access
3-D Localization With Multiple LEDs Lamps in OFDM-VLC System.,IEEE Access
Analysis of Coding Strategies Within File Delivery Protocol Framework for HbbTV Based Push-VoD Services Over DVB Networks.,IEEE Access
Sharing of Copper Pairs for Improving DSL Performance in FTTx Access Networks.,IEEE Access
Modulation Analysis in Macro-Molecular Communications.,IEEE Access
Molecular-Based Nano-Communication Network - A Ring Topology Nano-Bots for In-Vivo Drug Delivery Systems.,IEEE Access
A Decision Support System for Managing the Water Space.,IEEE Access
HARD-DE - Hierarchical ARchive Based Mutation Strategy With Depth Information of Evolution for the Enhancement of Differential Evolution on Numerical Optimization.,IEEE Access
Output Voltage Identification Based on Transmitting Side Information for Implantable Wireless Power Transfer System.,IEEE Access
Implementation of Flat Gain Broadband Power Amplifier With Impedance Rotation Compensation.,IEEE Access
Quantum Algorithm for Spectral Regression for Regularized Subspace Learning.,IEEE Access
Indoor Positioning of RBF Neural Network Based on Improved Fast Clustering Algorithm Combined With LM Algorithm.,IEEE Access
Bilinear Adaptive Generalized Vector Approximate Message Passing.,IEEE Access
Efficient Confidence-Based Hierarchical Stereo Disparity Upsampling for Noisy Inputs.,IEEE Access
Experimental Multi-User Visible Light Communication Attocell Using Multiband Carrierless Amplitude and Phase Modulation.,IEEE Access
Searching With Direction Awareness - Multi-Objective Genetic Algorithm Based on Angle Quantization and Crowding Distance MOGA-AQCD.,IEEE Access
Efficient Multiple Concatenated Codes With Turbo-Like Decoding for UEP Wireless Transmission of Scalable JPEG 2000 Images.,IEEE Access
Insulator Detection in Aerial Images for Transmission Line Inspection Using Single Shot Multibox Detector.,IEEE Access
Deployable Linear-to-Circular Polarizer Using PDMS Based on Unloaded and Loaded Circular FSS Arrays for Pico-Satellites.,IEEE Access
Sensing Performance of Modified Single Mode Optical Fiber Coated With Nanomaterials-Based Ammonia Sensors Operated in the C-Band.,IEEE Access
Reliability and Power Density Increase in a Novel Four-Pole System for Line-Commutated Converter HVDC Transmission.,IEEE Access
Digitized Metamaterial Absorber-Based Compressive Reflector Antenna for High Sensing Capacity Imaging.,IEEE Access
The TRAVEE System for a Multimodal Neuromotor Rehabilitation.,IEEE Access
Ensemble Learning of Multiple-View 3D-CNNs Model for Micro-Nodules Identification in CT Images.,IEEE Access
Design of a Ku-Band High-Purity Transducer for the TM01 Circular Waveguide Mode by Means of T-Type Junctions.,IEEE Access
Massive MIMO Systems With Low-Resolution ADCs - Baseband Energy Consumption vs. Symbol Detection Performance.,IEEE Access
Interference Alignment Schemes Using Latin Square for K×3 MIMO X Channel.,IEEE Access
On-Device AI-Based Cognitive Detection of Bio-Modality Spoofing in Medical Cyber Physical System.,IEEE Access
Simultaneous Chaos Time-Delay Signature Cancellation and Bandwidth Enhancement in Cascade-Coupled Semiconductor Ring Lasers.,IEEE Access
Transmission Projective Synchronization of Multiple Non-Identical Coupled Chaotic Systems Using Sliding Mode Control.,IEEE Access
DeepAnT - A Deep Learning Approach for Unsupervised Anomaly Detection in Time Series.,IEEE Access
Augmented Reality Based on SLAM to Assess Spatial Short-Term Memory.,IEEE Access
Developing a Software That Supports the Improvement of the Theory of Mind in Children With Autism Spectrum Disorder.,IEEE Access
Development of a Wall-Climbing Drone Capable of Vertical Soft Landing Using a Tilt-Rotor Mechanism.,IEEE Access
Joint Uplink and Downlink Resource Allocation for the Internet of Things.,IEEE Access
Study on Mutual Coupling Reduction Technique for MIMO Antennas.,IEEE Access
Comparative Review of Energy Storage Systems, Their Roles, and Impacts on Future Power Systems.,IEEE Access
Drift-Diffusion Versus Monte Carlo Simulated ON-Current Variability in Nanowire FETs.,IEEE Access
Exploiting Low Complexity Beam Allocation in Multi-User Switched Beam Millimeter Wave Systems.,IEEE Access
Efficient Object-Oriented Semantic Mapping With Object Detector.,IEEE Access
SER Analysis of Adaptive Threshold-Based Relay Selection With Limited Feedback for Type II Relay.,IEEE Access
CNVPS - Cooperative Neighboring Vehicle Positioning System Based on Vehicle-to-Vehicle Communication.,IEEE Access
Energy Internet via Packetized Management - Enabling Technologies and Deployment Challenges.,IEEE Access
Indoor Scene Understanding in 2.5/3D for Autonomous Agents - A Survey.,IEEE Access
Expert Control Systems Implemented in a Pitch Control of Wind Turbine - A Review.,IEEE Access
Branch Point Selection in RNA Splicing Using Deep Learning.,IEEE Access
Process Yield Index and Variable Sampling Plans for Autocorrelation Between Nonlinear Profiles.,IEEE Access
A Single-Channel SSVEP-Based BCI Speller Using Deep Learning.,IEEE Access
Improved Model Predictive Control by Robust Prediction and Stability-Constrained Finite States for Three-Phase Inverters With an Output LC Filter.,IEEE Access
Selective Timewarp Based on Embedded Motion Vectors for Interactive Cloud Virtual Reality.,IEEE Access
Reliability and Availability Evaluation for Cloud Data Center Networks Using Hierarchical Models.,IEEE Access
A Decentralized Reciprocity Calibration Approach for Cooperative MIMO.,IEEE Access
Deep Feature Ranking for Person Re-Identification.,IEEE Access
Fast, Area &amp; Energy Efficient Supergate Design With Multi-Output &amp; Multi-Functional CDM Cells.,IEEE Access
Topological Analysis on the Belief Rule Base Space.,IEEE Access
Stabilization of a Relative Equilibrium for an Underactuated AUV With Disturbances Rejection.,IEEE Access
Target Detection Algorithm for Hypersonic Vehicle Based on Wideband Radar Echo Model.,IEEE Access
2D and 3D Image Quality Assessment - A Survey of Metrics and Challenges.,IEEE Access
Performances Enhancement of Fingerprint Recognition System Using Classifiers.,IEEE Access
Carrier Aggregated Radio-Over-Fiber Downlink for Achieving 2Gbps for 5G Applications.,IEEE Access
Power and Speed Evaluation of Hyper-FET Circuits.,IEEE Access
A New Chaotic Oscillator - Properties, Analog Implementation, and Secure Communication Application.,IEEE Access
Packet Level Performance Assessment of mmWave Backhauling Technology for 3GPP NR Systems.,IEEE Access
Sliding Time Window Electricity Consumption Optimization Algorithm for Communities in the Context of Big Data Processing.,IEEE Access
Robust Gossiping for Distributed Average Consensus in IoT Environments.,IEEE Access
Deep Learning Class Discrimination Based on Prior Probability for Human Activity Recognition.,IEEE Access
New Approach for Automated Epileptic Disease Diagnosis Using an Integrated Self-Organization Map and Radial Basis Function Neural Network Algorithm.,IEEE Access
Sliding-Mode-Based Trajectory Tracking and Load Sway Suppression Control for Double-Pendulum Overhead Cranes.,IEEE Access
Novel Adaptive Hierarchical Sliding Mode Control for Trajectory Tracking and Load Sway Rejection in Double-Pendulum Overhead Cranes.,IEEE Access
Design and Analysis of Triplen Controlled Resonant Converter for Renewable Sources to Interface DC Micro Grid.,IEEE Access
A Novel Modified Sine-Cosine Optimized MPPT Algorithm for Grid Integrated PV System under Real Operating Conditions.,IEEE Access
Internet of Perishable Logistics - Building Smart Fresh Food Supply Chain Networks.,IEEE Access
Motion Recommender for Preventing Injuries During Motion Gaming.,IEEE Access
Approximate Similarity Measurements on Multi-Attributes Trajectories Data.,IEEE Access
Impact Analysis and Optimization of Material Parameters of Insulator on Brake Squeal.,IEEE Access
Clone Detection Based on Physical Layer Reputation for Proximity Service.,IEEE Access
Application of Internet of Things Technology in 3D Medical Image Model.,IEEE Access
Design of H∞ Output Feedback Controller for Gas Turbine Engine Distributed Control With Random Packet Dropouts.,IEEE Access
Deploying Public Charging Stations for Electric Taxis - A Charging Demand Simulation Embedded Approach.,IEEE Access
An Incentive Mechanism Based on a Bayesian Game for Spatial Crowdsourcing.,IEEE Access
Introducing Deep Learning Self-Adaptive Misuse Network Intrusion Detection Systems.,IEEE Access
Cross-Correlation Aided Ensemble of Classifiers for BCI Oriented EEG Study.,IEEE Access
A Programmable Multi-Biomarker Neural Sensor for Closed-Loop DBS.,IEEE Access
Eight-Element Dual-Polarized MIMO Slot Antenna System for 5G Smartphone Applications.,IEEE Access
Electromagnetic Scattering of Periodic Cabinets in Nuclear Power Plants - Parallel Polarization.,IEEE Access
Can Machines Learn to Comprehend Scientific Literature?,IEEE Access
Natural Language Generation Using Dependency Tree Decoding for Spoken Dialog Systems.,IEEE Access
Frame-Type-Aware Static Time Slotted Channel Hopping Scheduling Scheme for Large-Scale Smart Metering Networks.,IEEE Access
Quantitative Identification of Technological Discontinuities.,IEEE Access
Power Control for Sum Spectral Efficiency Optimization in MIMO-NOMA Systems With Linear Beamforming.,IEEE Access
Hybrid Load Forecasting for Mixed-Use Complex Based on the Characteristic Load Decomposition by Pilot Signals.,IEEE Access
Application of Tiling Theory for Path Planning Strategy in a Polyiamond Inspired Reconfigurable Robot.,IEEE Access
Gene Expression Analysis for Early Lung Cancer Prediction Using Machine Learning Techniques - An Eco-Genomics Approach.,IEEE Access
Novel Two-Fold Data Aggregation and MAC Scheduling to Support Energy Efficient Routing in Wireless Sensor Network.,IEEE Access
Challenging the Boundaries of Unsupervised Learning for Semantic Similarity.,IEEE Access
Distributed Channel Allocation for D2D-Enabled 5G Networks Using Potential Games.,IEEE Access
Digital Image Inpainting by Estimating Wavelet Coefficient Decays From Regularity Property and Besov Spaces.,IEEE Access
Full State Tracking and Formation Control for Under-Actuated VTOL UAVs.,IEEE Access
AP Selection Scheme Based on Achievable Throughputs in SDN-Enabled WLANs.,IEEE Access
Algorithms for Interval-Valued Pythagorean Fuzzy Sets in Emergency Decision Making Based on Multiparametric Similarity Measures and WDBA.,IEEE Access
Wide-Area Vehicle-Drone Cooperative Sensing - Opportunities and Approaches.,IEEE Access
A Novel Deeper One-Dimensional CNN With Residual Learning for Fault Diagnosis of Wheelset Bearings in High-Speed Trains.,IEEE Access
A New Hierarchical Framework for Detection and Isolation of Multiple Faults in Complex Industrial Processes.,IEEE Access
Analysis of Morphing Modes of Hypersonic Morphing Aircraft and Multiobjective Trajectory Optimization.,IEEE Access
HARSAM - A Hybrid Model for Recommendation Supported by Self-Attention Mechanism.,IEEE Access
Social Media Based Topic Modeling for Smart Campus - A Deep Topical Correlation Analysis Method.,IEEE Access
Usability Study of a Web-Based Platform for Home Motor Rehabilitation.,IEEE Access
Metabolic Syndrome and Development of Diabetes Mellitus - Predictive Modeling Based on Machine Learning Techniques.,IEEE Access
Minimal Realizations of Autonomous Chaotic Oscillators Based on Trans-Immittance Filters.,IEEE Access
Artificial-Noise-Aided Precoding Design for Multi-User Visible Light Communication Channels.,IEEE Access
Facial Action Units-Based Image Retrieval for Facial Expression Recognition.,IEEE Access
Mobile Edge Computing With Wireless Backhaul - Joint Task Offloading and Resource Allocation.,IEEE Access
A Review of Mobile Crowdsourcing Architectures and Challenges - Toward Crowd-Empowered Internet-of-Things.,IEEE Access
Analysis of Smart Loads in Nanogrids.,IEEE Access
Joint Positioning of Flying Base Stations and Association of Users - Evolutionary-Based Approach.,IEEE Access
Displacement-Tolerant Printed Spiral Resonator With Capacitive Compensated-Plates for Non-Radiative Wireless Energy Transfer.,IEEE Access
A Survey on Energy Efficient Narrowband Internet of Things (NBIoT) - Architecture, Application and Challenges.,IEEE Access
A Sensor Based on a Spherical Parallel Mechanism for the Measurement of Fluid Velocity - Experimental Development.,IEEE Access
An Indoor Position-Estimation Algorithm Using Smartphone IMU Sensor Data.,IEEE Access
Modeling Metropolitan-Area Ambulance Mobility Under Blue Light Conditions.,IEEE Access
Dynamic Wireless Power Transfer for Cost-Effective Wireless Sensor Networks Using Frequency-Scanned Beaming.,IEEE Access
A Hierarchical Adaptation Method for Administrative Workflows.,IEEE Access
Low-Light Image Enhancement by Principal Component Analysis.,IEEE Access
Personalized Sketch-Based Image Retrieval by Convolutional Neural Network and Deep Transfer Learning.,IEEE Access
A Novel Ideal Point Method for Uncertain Random Multi-Objective Programming Problem Under PE Criterion.,IEEE Access
Development of Modular Cable-Driven Parallel Robotic Systems.,IEEE Access
Adaptive Downlink OFDMA System With Low-Overhead and Limited Feedback in Time-Varying Underwater Acoustic Channel.,IEEE Access
A New Evaluation Method of Aging Properties for Silicon Rubber Material Based on Microscopic Images.,IEEE Access
A Novel Steganography for Spatial Color Images Based on Pixel Vector Cost.,IEEE Access
Data Analysis Approaches of Interval-Valued Fuzzy Soft Sets Under Incomplete Information.,IEEE Access
Terminal Guidance Based on Bézier Curve for Climb-and-Dive Maneuvering Trajectory With Impact Angle Constraint.,IEEE Access
Online User Distribution-Aware Virtual Machine Re-Deployment and Live Migration in SDN-Based Data Centers.,IEEE Access
Model-Predictive-Control-Based Flexible Arc-Suppression Method for Earth Fault in Distribution Networks.,IEEE Access
Ensemble Learning for Power Systems TTC Prediction With Wind Farms.,IEEE Access
Robust Adaptive Trajectory Linearization Control for Tracking Control of Surface Vessels With Modeling Uncertainties Under Input Saturation.,IEEE Access
A High-Efficiency Fully Convolutional Networks for Pixel-Wise Surface Defect Detection.,IEEE Access
Design of a Frequency-Selective Rasorber Based on Notch Structure.,IEEE Access
Sparse Data Acquisition on Emerging Memory Architectures.,IEEE Access
EMI-Free Bidirectional Real-Time Indoor Environment Monitoring System.,IEEE Access
Evolution of Physical-Layer Communications Research in the Post-5G Era.,IEEE Access
Label-Free Detection of Dissolved Carbon Dioxide Utilizing Multimode Tapered Optical Fiber Coated Zinc Oxide Nanorice.,IEEE Access
Performance Analysis of a Three-to-Five Phase Dual Matrix Converter Based on Space Vector Pulse Width Modulation.,IEEE Access
Receiver Design to Employ Simultaneous Wireless Information and Power Transmission with Joint CFO and Channel Estimation.,IEEE Access
Proportional Retarded Control of Robot Manipulators.,IEEE Access
A Posteriori Multiobjective Self-Adaptive Multipopulation Jaya Algorithm for Optimization of Thermal Devices and Cycles.,IEEE Access
A Roadmap Toward the Resilient Internet of Things for Cyber-Physical Systems.,IEEE Access
An Optimal Low Complexity PAPR Reduction Technique for Next Generation OFDM Systems.,IEEE Access
Gate Switch Selection for In-Band Controlling in Software Defined Networking.,IEEE Access
A Taxonomy and Survey of Semantic Approaches for Query Expansion.,IEEE Access
Automatic Visual Features for Writer Identification - A Deep Learning Approach.,IEEE Access
Finite-Time Non-Fragile Control of a Class of Uncertain Linear Positive Systems.,IEEE Access
An Executable Specification of Map-Join-Reduce Using Haskell.,IEEE Access
A Broadband Magnetic Coupling Microstrip to Waveguide Transition Using Complementary Split Ring Resonators.,IEEE Access
Cognitive Radio Made Practical - Forward-Lookingness and Calculated Competition.,IEEE Access
Greedy Code Search Based Memetic Algorithm for the Design of Orthogonal Polyphase Code Sets.,IEEE Access
When Less Is More ... Few Bit ADCs in RF Systems.,IEEE Access
New Approach for Conversational Agent Definition by Non-Programmers - A Visual Domain-Specific Language.,IEEE Access
Weld Bead Detection Based on 3D Geometric Features and Machine Learning Approaches.,IEEE Access
Scalable Hardware-Based On-Board Processing for Run-Time Adaptive Lossless Hyperspectral Compression.,IEEE Access
Clasp-Knife Model of Muscle Spasticity for Simulation of Robot-Human Interaction.,IEEE Access
Design, Implementation and Control of an Improved Hybrid Pneumatic-Electric Actuator for Robot Arms.,IEEE Access
Adaptive Interaction Controller for Compliant Robot Base Applications.,IEEE Access
A PARAFAC Decomposition Algorithm for DOA Estimation in Colocated MIMO Radar With Imperfect Waveforms.,IEEE Access
A Survey on Biometric Authentication - Toward Secure and Privacy-Preserving Identification.,IEEE Access
Beamforming and Resource Allocation for a Multi-Pair Wireless Powered Two-Way Relay Network With Fairness.,IEEE Access
Towards Optimizing WLANs Power Saving - Novel Context-Aware Network Traffic Classification Based on a Machine Learning Approach.,IEEE Access
Low Cross-Polarization, High-Isolation Microstrip Patch Antenna Array for Multi-Mission Applications.,IEEE Access
Efficient Calculation of Minimum Distance Between Capsules and Its Use in Robotics.,IEEE Access
A Comprehensive Review of Enhancements and Prospects of Fast Handovers for Mobile IPv6 Protocol.,IEEE Access
Illumination-Aware Multi-Task GANs for Foreground Segmentation.,IEEE Access
Blockchain for AI - Review and Open Research Challenges.,IEEE Access
IPSO Task Scheduling Algorithm for Large Scale Data in Cloud Computing Environment.,IEEE Access
AMOGA - A Static-Dynamic Model Generation Strategy for Mobile Apps Testing.,IEEE Access
An Asymptotic Ensemble Learning Framework for Big Data Analysis.,IEEE Access
Intelligent EMG Pattern Recognition Control Method for Upper-Limb Multifunctional Prostheses - Advances, Current Challenges, and Future Prospects.,IEEE Access
Design and Application of Project-Based Learning Methodologies for Small Groups Within Computer Fundamentals Subjects.,IEEE Access
Aligning Business Processes With the Services Layer Using a Semantic Approach.,IEEE Access
Multi-Scale Context Attention Network for Stereo Matching.,IEEE Access
GrEDeL - A Knowledge Graph Embedding Based Method for Drug Discovery From Biomedical Literatures.,IEEE Access
Using Deep Convolutional Neural Network for Emotion Detection on a Physiological Signals Dataset (AMIGOS).,IEEE Access
A Graph-Theory-Based Method for Topological and Dimensional Representation of Planar Mechanisms as a Computational Tool for Engineering Design.,IEEE Access
Generating Synthetic Missing Data - A Review by Missing Mechanism.,IEEE Access
Sensing Platform for Two-Phase Flow Studies.,IEEE Access
An Efficient Neighbor Discovery Scheme for Mobile WSN.,IEEE Access
dSPACE Controller-Based Enhanced Piezoelectric Energy Harvesting System Using PI-Lightning Search Algorithm.,IEEE Access
Error Analysis of a Near-Field Reconstruction Technique Based on Plane Wave Spectrum Expansion for Power Density Assessment Above 6 GHz.,IEEE Access
Riemannian Optimal Model Reduction of Stable Linear Systems.,IEEE Access
Credibility Evaluation of Twitter-Based Event Detection by a Mixing Analysis of Heterogeneous Data.,IEEE Access
Prediction of Electroencephalogram Time Series With Electro-Search Optimization Algorithm Trained Adaptive Neuro-Fuzzy Inference System.,IEEE Access
Hierarchical Facial Age Estimation Using Gaussian Process Regression.,IEEE Access
Multipath and Doppler Characterization of an Electromagnetic Environment by Massive MDT Measurements From 3G and 4G Mobile Terminals.,IEEE Access
A Distributed Power System Control Architecture for Improved Distribution System Resiliency.,IEEE Access
Determination of Radiation Pressure in Acoustic Levitation by Optical Acoustic-Field Measurement.,IEEE Access
The Minimization of Public Facilities With Enhanced Genetic Algorithms Using War Elimination.,IEEE Access
A Novel Wide, Dual-and Triple-Band Frequency Reconfigurable Butler Matrix Based on Transmission Line Resonators.,IEEE Access
On the Outage Probability and Power Control of D2D Underlaying NOMA UAV-Assisted Networks.,IEEE Access
Exploring Social Media Network Landscape of Post-Soviet Space.,IEEE Access
Security of Functionally Obfuscated DSP Core Against Removal Attack Using SHA-512 Based Key Encryption Hardware.,IEEE Access
Vocal Effort Based Speaking Style Conversion Using Vocoder Features and Parallel Learning.,IEEE Access
Measuring Performance Through Enterprise Resource Planning System Implementation.,IEEE Access
Student Outcomes Assessment Methodology for ABET Accreditation - A Case Study of Computer Science and Computer Information Systems Programs.,IEEE Access
Wiretap TDMA Networks With Energy-Harvesting Rechargeable-Battery Buffered Sources.,IEEE Access
Analysis and Evaluation of Random Access Transmission for UAV-Assisted Vehicular-to-Infrastructure Communications.,IEEE Access
The Role of Big Data Predictive Analytics and Radio Frequency Identification in the Pharmaceutical Industry.,IEEE Access
Channel Constrained Multiple Selective Retransmissions for OFDM System - BER and Throughput Analysis.,IEEE Access
Time Barrier-Based Emergency Message Dissemination in Vehicular Ad-hoc Networks.,IEEE Access
Chip Power Scaling in Recent CMOS Technology Nodes.,IEEE Access
Quantification of Productivity of the Brands on Social Media With Respect to Their Responsiveness.,IEEE Access
Radio Source Localization in Multipath Channels Using EM Lens Assisted Massive Antennas Arrays.,IEEE Access
Neural Network Based Brain Tumor Detection Using Wireless Infrared Imaging Sensor.,IEEE Access
Robust Median Filtering Forensics Using Image Deblocking and Filtered Residual Fusion.,IEEE Access
A Review of Ant Colony Optimization Based Methods for Detecting Epistatic Interactions.,IEEE Access
Collaborative Learning for Answer Selection in Question Answering.,IEEE Access
Domain-Specific Chinese Word Segmentation Based on Bi-Directional Long-Short Term Memory Model.,IEEE Access
A Low Power Cryptography Solution Based on Chaos Theory in Wireless Sensor Nodes.,IEEE Access
Secure and Reliable Resource Allocation and Caching in Aerial-Terrestrial Cloud Networks (ATCNs).,IEEE Access
FPGA-Based Accelerators of Deep Learning Networks for Learning and Classification - A Review.,IEEE Access
Nearest Centroid Neighbor Based Sparse Representation Classification for Finger Vein Recognition.,IEEE Access
Extracting Centerlines From Dual-Line Roads Using Superpixel Segmentation.,IEEE Access
LPI-KTASLP - Prediction of LncRNA-Protein Interaction by Semi-Supervised Link Learning With Multivariate Information.,IEEE Access
The NMHSS Iterative Method for the Standard Lyapunov Equation.,IEEE Access
Golay Code Based Bit Mismatch Mitigation for Wireless Channel Impulse Response Based Secrecy Generation.,IEEE Access
Suppressing Sidelobe Level of the Planar Antenna Array in Wireless Power Transmission.,IEEE Access
Modeling Stochastic Overload Delay in a Reliability-Based Transit Assignment Model.,IEEE Access
Tree-Search-Based Any-Time Time-Optimal Path-Constrained Trajectory Planning With Inadmissible Island Constraints.,IEEE Access
Enhanced Association With Supervoxels in Multiple Hypothesis Tracking.,IEEE Access
Learning Robust Auto-Encoders With Regularizer for Linearity and Sparsity.,IEEE Access
Controllable Sparse Antenna Array for Adaptive Beamforming.,IEEE Access
Performance Analysis for User-Centric Dense Networks With mmWave.,IEEE Access
An Enabling Multi-Operation Branch-Line Coupler.,IEEE Access
Sparse Recovery With Block Multiple Measurement Vectors Algorithm.,IEEE Access
A 1-D Tightly Coupled Dipole Array for Broadband mmWave Communication.,IEEE Access
Revenue Model of Supply Chain by Internet of Things Technology.,IEEE Access
Design and Hardware Implementation Considerations of Modified Multilevel Cascaded H-Bridge Inverter for Photovoltaic System.,IEEE Access
Three-Parallel Co-Prime Polarization Sensitive Array for 2-D DOA and Polarization Estimation via Sparse Representation.,IEEE Access
Interference Mitigation for 5G Millimeter-Wave Communications.,IEEE Access
Ultralightweight Mutual Authentication RFID Protocol for Blockchain Enabled Supply Chains.,IEEE Access
On the Inter-Departure Times in M/D̃/1/Bon Queue With Queue-Length Dependent Service and Deterministic/Exponential Vacations.,IEEE Access
Categorical Variable Segmentation Model for Software Development Effort Estimation.,IEEE Access
Parallel Implementation of Reinforcement Learning Q-Learning Technique for FPGA.,IEEE Access
Decision Provenance - Harnessing Data Flow for Accountable Systems.,IEEE Access
Neo-Bedside Monitoring Device for Integrated Neonatal Intensive Care Unit (iNICU).,IEEE Access
Moment-Based Approach for Statistical and Simulative Analysis of Turbulent Atmospheric Channels in FSO Communication.,IEEE Access
