Three questions of Bertram on locally maximal sum-free sets.,Appl. Algebra Eng. Commun. Comput.
On the Cipolla-Lehmer type algorithms in finite fields.,Appl. Algebra Eng. Commun. Comput.
Quantum codes from cyclic codes over the ring 𝔽q + v1𝔽q + ⋯ + vr 𝔽q.,Appl. Algebra Eng. Commun. Comput.
Computing with D-algebraic power series.,Appl. Algebra Eng. Commun. Comput.
On the near prime-order MNT curves.,Appl. Algebra Eng. Commun. Comput.
Several classes of binary linear codes and their weight enumerators.,Appl. Algebra Eng. Commun. Comput.
Orthogonal matrix and its application in Bloom&apos;s threshold scheme.,Appl. Algebra Eng. Commun. Comput.
Several classes of linear codes and their weight distributions.,Appl. Algebra Eng. Commun. Comput.
Two classes of optimal frequency-hopping sequences with new parameters.,Appl. Algebra Eng. Commun. Comput.
Four families of minimal binary linear codes with wmin/wmax ≤ 1/2.,Appl. Algebra Eng. Commun. Comput.
Directed path spaces via discrete vector fields.,Appl. Algebra Eng. Commun. Comput.
A Non-Intrusive Heuristic for Energy Messaging Intervention Modeled Using a Novel Agent-Based Approach.,IEEE Access
Low-Order Space Harmonic Modeling of Asymmetrical Six-Phase Induction Machines.,IEEE Access
RFI Cancellation for an Array Radio Astronomy System With Receiver Nonlinearity.,IEEE Access
Performance Analysis of MICS-Based RF Wireless Power Transfer System for Implantable Medical Devices.,IEEE Access
Fog Load Balancing for Massive Machine Type Communications - A Game and Transport Theoretic Approach.,IEEE Access
Discrete-Time Adaptive Control for Systems With Input Time-Delay and Non-Sector Bounded Nonlinear Functions.,IEEE Access
Using Beamforming for Dense Frequency Reuse in 5G.,IEEE Access
Gale-Shapley Matching Game Selection - A Framework for User Satisfaction.,IEEE Access
A Survey on Mobile Crowd-Sensing and Its Applications in the IoT Era.,IEEE Access
Improved Dynamic Multi-Party Quantum Private Comparison for Next-Generation Mobile Network.,IEEE Access
Native Language Identification in Very Short Utterances Using Bidirectional Long Short-Term Memory Network.,IEEE Access
A Multivariate Homogeneously Weighted Moving Average Control Chart.,IEEE Access
Internet of Things - A Comprehensive Study of Security Issues and Defense Mechanisms.,IEEE Access
State-of-the-Art Clustering Schemes in Mobile Ad Hoc Networks - Objectives, Challenges, and Future Directions.,IEEE Access
State-of-Art in Nano-Based Dielectric Oil - A Review.,IEEE Access
State-of-Charge Balancing Control for ON/OFF-Line Internal Cells Using Hybrid Modular Multi-Level Converter and Parallel Modular Dual L-Bridge in a Grid-Scale Battery Energy Storage System.,IEEE Access
Aspects of Quality in Internet of Things (IoT) Solutions - A Systematic Mapping Study.,IEEE Access
Primitive Polynomials for Iterative Recursive Soft Sequential Acquisition of Concatenated Sequences.,IEEE Access
Incision Sensor Using Conductive Tape for Cricothyrotomy Training Simulation With Quantitative Feedback.,IEEE Access
Improving Urdu Recognition Using Character-Based Artistic Features of Nastalique Calligraphy.,IEEE Access
Lightweight and Low-Loss 3-D Printed Millimeter-Wave Bandpass Filter Based on Gap-Waveguide.,IEEE Access
Spectrum Sharing in Multi-Tenant 5G Cellular Networks - Modeling and Planning.,IEEE Access
Secrecy Performance of Decode-and-Forward Based Hybrid RF/VLC Relaying Systems.,IEEE Access
Comprehensive Review of the Development of the Harmony Search Algorithm and its Applications.,IEEE Access
A Model of Factors Affecting Cyber Bullying Behaviors Among University Students.,IEEE Access
Reliable Middleware for Wireless Sensor-Actuator Networks.,IEEE Access
Network Experience Scheduling and Routing Approach for Big Data Transmission in the Internet of Things.,IEEE Access
Finite-Time Lag Synchronization of Uncertain Complex Dynamical Networks With Disturbances via Sliding Mode Control.,IEEE Access
Credibility in Online Social Networks - A Survey.,IEEE Access
Data-Driven Dynamic Active Node Selection for Event Localization in IoT Applications - A Case Study of Radiation Localization.,IEEE Access
Efficient Face Recognition Using Regularized Adaptive Non-Local Sparse Coding.,IEEE Access
Hybrid Stochastic Exploration Using Grey Wolf Optimizer and Coordinated Multi-Robot Exploration Algorithms.,IEEE Access
Group L1/2 Regularization for Pruning Hidden Layer Nodes of Feedforward Neural Networks.,IEEE Access
Analytical Approach of Director Tilting in Nematic Liquid Crystals for Electronically Tunable Devices.,IEEE Access
Queuing Delay Model for Video Transmission Over Multi-Channel Underwater Wireless Optical Networks.,IEEE Access
A New Frequency Control Strategy in an Islanded Microgrid Using Virtual Inertia Control-Based Coefficient Diagram Method.,IEEE Access
Deep Reinforcement Learning Paradigm for Performance Optimization of Channel Observation-Based MAC Protocols in Dense WLANs.,IEEE Access
A Novel Nested Q-Learning Method to Tackle Time-Constrained Competitive Influence Maximization.,IEEE Access
Motion Artifact Detection and Reduction in Bed-Based Ballistocardiogram.,IEEE Access
Smart Information Retrieval - Domain Knowledge Centric Optimization Approach.,IEEE Access
Evolutionary Deep Learning-Based Energy Consumption Prediction for Buildings.,IEEE Access
Arabic Word Segmentation With Long Short-Term Memory Neural Networks and Word Embedding.,IEEE Access
Exact Coupling Method for Stratonovich Stochastic Differential Equation Using Non-Degeneracy for the Diffusion.,IEEE Access
A Survey of Super-Resolution in Iris Biometrics With Evaluation of Dictionary-Learning.,IEEE Access
On the Development of a Novel Mixed Embroidered-Woven Slot Antenna for Wireless Applications.,IEEE Access
From Threads to Smart Textile - Parametric Characterization and Electromagnetic Analysis of Woven Structures.,IEEE Access
Registration Center Based User Authentication Scheme for Smart E-Governance Applications in Smart Cities.,IEEE Access
A Game-Theoretical Modelling Approach for Enhancing the Physical Layer Security of Non-Orthogonal Multiple Access System.,IEEE Access
Null-Steering Beamforming for Enhancing the Physical Layer Security of Non-Orthogonal Multiple Access System.,IEEE Access
Impact of Two-Way Communication of Traffic Light Signal-to-Vehicle on the Electric Vehicle State of Charge.,IEEE Access
Interactive Data Exploration of Distributed Raw Files - A Systematic Mapping Study.,IEEE Access
Improving Multipath Routing of TCP Flows by Network Exploration.,IEEE Access
A Family of Scalable Non-Isolated Interleaved DC-DC Boost Converters With Voltage Multiplier Cells.,IEEE Access
Cognitive Smart Healthcare for Pathology Detection and Monitoring.,IEEE Access
Advanced Fault Tolerant Air-Fuel Ratio Control of Internal Combustion Gas Engine for Sensor and Actuator Faults.,IEEE Access
APA - Adaptive Pose Alignment for Pose-Invariant Face Recognition.,IEEE Access
A Novel Fuzzy Approach for Combining Uncertain Conflict Evidences in the Dempster-Shafer Theory.,IEEE Access
Wireless Control of Robotic Artificial Hand Using Myoelectric Signal Based on Wideband Human Body Communication.,IEEE Access
Deployment of IoV for Smart Cities - Applications, Architecture, and Challenges.,IEEE Access
98-dB Gain Class-AB OTA With 100 pF Load Capacitor in 180-nm Digital CMOS Process.,IEEE Access
Device-to-Device (D2D) Communication as a Bootstrapping System in a Wireless Cellular Network.,IEEE Access
An Empirical Study on Forensic Analysis of Urdu Text Using LDA-Based Authorship Attribution.,IEEE Access
A Survey on Cluster-Based Routing Protocols for Unmanned Aerial Vehicle Networks.,IEEE Access
Long-Term Operational Data Analysis of an In-Service Wind Turbine DFIG.,IEEE Access
A Novel RF-Powered Wireless Pacing via a Rectenna-Based Pacemaker and a Wearable Transmit-Antenna Array.,IEEE Access
Analysis of Transient Behavior of Mixed High Voltage DC Transmission Line Under Lightning Strikes.,IEEE Access
Attribute Control Chart Using the Repetitive Sampling Under Neutrosophic System.,IEEE Access
Design of a Control Chart for Gamma Distributed Variables Under the Indeterminate Environment.,IEEE Access
Real-Time Imaging of Particles Distribution in Centrifugal Particles-Liquid Two-Phase Fields by Wireless Electrical Resistance Tomography (WERT) System.,IEEE Access
Friction Damper-Based Passive Vibration Control Assessment for Seismically-Excited Buildings Through Comparison With Active Control - A Case Study.,IEEE Access
Circuit Aware Approximate System Design With Case Studies in Image Processing and Neural Networks.,IEEE Access
ISO/IEEE 11073 Personal Health Device (X73-PHD) Standards Compliant Systems - A Systematic Literature Review.,IEEE Access
Low Leakage Current Symmetrical Dual-k 7 nm Trigate Bulk Underlap FinFET for Ultra Low Power Applications.,IEEE Access
An Adaptive Sliding Mode Control With Effective Switching Gain Tuning Near the Sliding Surface.,IEEE Access
Finite-Difference Time-Domain Modeling for Electromagnetic Wave Analysis of Human Voxel Model at Millimeter-Wave Frequencies.,IEEE Access
BIG DATA for Healthcare - A Survey.,IEEE Access
Weighted Incoherent Signal Subspace Method for DOA Estimation on Wideband Colored Signals.,IEEE Access
Development of a Novel Home Based Multi-Scene Upper Limb Rehabilitation Training and Evaluation System for Post-Stroke Patients.,IEEE Access
Scientific Paper Recommendation - A Survey.,IEEE Access
Performance of HARQ-Assisted OFDM Systems Contaminated by Impulsive Noise - Finite-Length LDPC Code Analysis.,IEEE Access
Series Current Flow Controllers for DC Grids.,IEEE Access
Integrated Test Automation for Evaluating a Motion-Based Image Capture System Using a Robotic Arm.,IEEE Access
Incast Mitigation in a Data Center Storage Cluster Through a Dynamic Fair-Share Buffer Policy.,IEEE Access
Machine Learning Based Optimized Pruning Approach for Decoding in Statistical Machine Translation.,IEEE Access
Research on Series Arc Fault Detection Based on Higher-Order Cumulants.,IEEE Access
A Secure Authentication Protocol for Multi-Server-Based E-Healthcare Using a Fuzzy Commitment Scheme.,IEEE Access
VERB - VFCDM-Based Electrocardiogram Reconstruction and Beat Detection Algorithm.,IEEE Access
MF-TDMA Scheduling Algorithm for Multi-Spot Beam Satellite Systems Based on Co-Channel Interference Evaluation.,IEEE Access
Automated 3-D Retinal Layer Segmentation From SD-OCT Images With Neurosensory Retinal Detachment.,IEEE Access
Energy-Delay Evaluation and Optimization for NB-IoT PSM With Periodic Uplink Reporting.,IEEE Access
A High-Speed, Scalable, and Programmable Traffic Manager Architecture for Flow-Based Networking.,IEEE Access
Ultrafast Rectifier for Variable-Frequency Applications.,IEEE Access
Quality-Driven Detection and Resolution of Metamodel Smells.,IEEE Access
Low-Power (1T1N) Skyrmionic Synapses for Spiking Neuromorphic Systems.,IEEE Access
A Modified NSGA-II for Solving Control Allocation Optimization Problem in Lateral Flight Control System for Large Aircraft.,IEEE Access
Mitigating the Impact of Renewable Variability With Demand-Side Resources Considering Communication and Cyber Security Limitations.,IEEE Access
Analyzing Emergent Users&apos; Text Messages Data and Exploring Its Benefits.,IEEE Access
Semiparametric Correction for Endogenous Truncation Bias With Vox Populi-Based Participation Decision.,IEEE Access
Model Predictive Control of Marine Power Plants With Gas Engines and Battery.,IEEE Access
Multi-Band Vehicle-to-Vehicle Channel Characterization in the Presence of Vehicle Blockage.,IEEE Access
Analyzing Covariate Influence on Gender and Race Prediction From Near-Infrared Ocular Images.,IEEE Access
Experimental Design via Generalized Mean Objective Cost of Uncertainty.,IEEE Access
Realistic Multi-Scale Modeling of Household Electricity Behaviors.,IEEE Access
Analytical Performance Assessment of THz Wireless Systems.,IEEE Access
Deriving Probabilistic SVM Kernels From Flexible Statistical Mixture Models and its Application to Retinal Images Classification.,IEEE Access
Day-Ahead and Intraday Forecasts of the Dynamic Line Rating for Buried Cables.,IEEE Access
Compact Leaky SIW Feeder Offering TEM Parallel Plate Waveguide Launching.,IEEE Access
Design and Measurement of 3D Flexible Antenna Diversity for Ambient RF Energy Scavenging in Indoor Scenarios.,IEEE Access
Low-Profile ESPAR Antenna for RSS-Based DoA Estimation in IoT Applications.,IEEE Access
Removal of Movement Artefact for Mobile EEG Analysis in Sports Exercises.,IEEE Access
Design of a Coupled Feed Structure With Cavity Walls for Extremely Small Anti-Jamming Arrays.,IEEE Access
An Efficient Strong Designated Verifier Signature Based on ℛ-SIS Assumption.,IEEE Access
Robust Model Predictive Control for a Class of Discrete-Time Markovian Jump Linear Systems With Operation Mode Disordering.,IEEE Access
Link Prediction Approach for Opportunistic Networks Based on Recurrent Neural Network.,IEEE Access
A New Adaptive Compensation Control for Parametric Systems With Actuator Aging.,IEEE Access
Event-Triggered Adaptive Control for Tank Gun Control Systems.,IEEE Access
Bibliographic Network Representation Based Personalized Citation Recommendation.,IEEE Access
Classification of 3D Archaeological Objects Using Multi-View Curvature Structure Signatures.,IEEE Access
Periodic Stabilization of Continuous-Time Multi-Module Impulsive Switched Linear Systems.,IEEE Access
Recent Advances of Generative Adversarial Networks in Computer Vision.,IEEE Access
A Robust Parameter-Free Thresholding Method for Image Segmentation.,IEEE Access
A Relay-Node Selection on Curve Road in Vehicular Networks.,IEEE Access
Reliable Integrated ASC and DYC Control of All-Wheel-Independent-Drive Electric Vehicles Over CAN Using a Co-Design Methodology.,IEEE Access
Assessment of Energy Management in a Fuel Cell/Battery Hybrid Vehicle.,IEEE Access
Method to Organize and Analyze Speed Data to Detect Unusual Traffic Activity.,IEEE Access
Distributed Continuous-Time Fault Estimation Control for Multiple Devices in IoT Networks.,IEEE Access
Visualization and Interpretation Tool for Expert Systems Based on Fuzzy Cognitive Maps.,IEEE Access
A Case for Malleable Thread-Level Linear Algebra Libraries - The LU Factorization With Partial Pivoting.,IEEE Access
Radio Channel Characterization of Mid-Band 5G Service Delivery for Ultra-Low Altitude Aerial Base Stations.,IEEE Access
Recommendation System Based on Singular Value Decomposition and Multi-Objective Immune Optimization.,IEEE Access
Modeling Educational Usage of Cloud-Based Tools in Virtual Learning Environments.,IEEE Access
Prune Deep Neural Networks With the Modified L1/2 Penalty.,IEEE Access
Machine-Learning-Based Parallel Genetic Algorithms for Multi-Objective Optimization in Ultra-Reliable Low-Latency WSNs.,IEEE Access
A Session-Based Customer Preference Learning Method by Using the Gated Recurrent Units With Attention Function.,IEEE Access
Hash-Polar Codes With Application to 5G.,IEEE Access
An Effective Approach for Obtaining a Group Trading Strategy Portfolio Using Grouping Genetic Algorithm.,IEEE Access
Optimized Handling Stability Control Strategy for a Four In-Wheel Motor Independent-Drive Electric Vehicle.,IEEE Access
Performance Improvement of Microwave Vector Modulator Through Coupler Characteristic Impedance Optimization and Bond-Wire Inductance Utilization.,IEEE Access
Design of Low-Cost Personal Identification System That Uses Combined Palm Vein and Palmprint Biometric Features.,IEEE Access
Deep Learning Assessment of Myocardial Infarction From MR Image Sequences.,IEEE Access
Bone Suppression of Chest Radiographs With Cascaded Convolutional Networks in Wavelet Domain.,IEEE Access
One Note About the Tu-Deng Conjecture in Case w nolimits(t)=5.,IEEE Access
Optimal Transport for Gaussian Mixture Models.,IEEE Access
Embedding Logic Rules Into Recurrent Neural Networks.,IEEE Access
Selective Range Iterative Adaptive Approach for High-Resolution DOA Estimation.,IEEE Access
XGBoost-Based Algorithm Interpretation and Application on Post-Fault Transient Stability Status Prediction of Power System.,IEEE Access
Study on Planetary Gear Degradation State Recognition Method Based on the Features With Multiple Perspectives and LLTSA.,IEEE Access
Metaphor Detection - Leveraging Culturally Grounded Eventive Information.,IEEE Access
Noncoherent Detection With Polar Codes.,IEEE Access
UAV Hovering Strategy Based on a Wirelessly Powered Communication Network.,IEEE Access
Recurrent Metric Networks and Batch Multiple Hypothesis for Multi-Object Tracking.,IEEE Access
Accurate and Fast Harmonic Detection Based on the Generalized Trigonometric Function Delayed Signal Cancellation.,IEEE Access
Optimizing Multi-Granularity Region Similarity for Person Re-Identification.,IEEE Access
Energy Efficiency Analysis of Bidirectional Wireless Information and Power Transfer for Cooperative Sensor Networks.,IEEE Access
Sparse DOA Estimation Algorithm Based on Fourth-Order Cumulants Vector Exploiting Restricted Non-Uniform Linear Array.,IEEE Access
A Spherical Actuator-Based Hand-Held Haptic Device for Touch Screen Interaction.,IEEE Access
Adaptive Neural-Network-Based Control for a Class of Nonlinear Systems With Unknown Output Disturbance and Time Delays.,IEEE Access
An Easily Fabricated Linear Piezoelectric Actuator Using Sandwich Longitudinal Vibrators With Four Driving Feet.,IEEE Access
Towards a Hybrid Expert System Based on Sleep Event&apos;s Threshold Dependencies for Automated Personalized Sleep Staging by Combining Symbolic Fusion and Differential Evolution Algorithm.,IEEE Access
Square-Root Cubature Information Hybrid Consensus Filter With Correlated Noise and Its Applications in Camera Networks.,IEEE Access
Optical Modeling and Physical Experiments on Ocular UV Manikins Exposure.,IEEE Access
Liveness of Disjunctive and Strict Single-Type Automated Manufacturing System - An ROPN Approach.,IEEE Access
Quantum Network Communication With a Novel Discrete-Time Quantum Walk.,IEEE Access
A Secure Authentication Protocol for Internet of Vehicles.,IEEE Access
Light-Weight and Privacy-Preserving Authentication Protocol for Mobile Payments in the Context of IoT.,IEEE Access
Multiview Transfer Learning for Software Defect Prediction.,IEEE Access
A Failure Mechanism Cumulative Model for Reliability Evaluation of a k-Out-of-n System With Load Sharing Effect.,IEEE Access
Automatic Leader-Follower Persistent Formation Control for Autonomous Surface Vehicles.,IEEE Access
Next Generation Technology for Epidemic Prevention and Control - Data-Driven Contact Tracking.,IEEE Access
Universal Design Approach for Multiport Filtering Power Divider.,IEEE Access
Reverse Offload Programming on Heterogeneous Systems.,IEEE Access
Numerical Analysis of Thermo-Electric Field for AC XLPE Cable in DC Operation Based on Conduction Current Measurement.,IEEE Access
High-Gain Circularly Polarized Fabry-Pérot Patch Array Antenna With Wideband Low-Radar-Cross-Section Property.,IEEE Access
An Active Learning Method Based on Uncertainty and Complexity for Gearbox Fault Diagnosis.,IEEE Access
Multi-Resolution Parallel Magnetic Resonance Image Reconstruction in Mobile Computing-Based IoT.,IEEE Access
A Horst-Type Power Divider With Wide Frequency Tuning Range Using Varactors.,IEEE Access
Reinforcement Learning-Based Sensor Access Control for WBANs.,IEEE Access
Planning City-Wide Package Distribution Schemes Using Crowdsourced Public Transportation Systems.,IEEE Access
Research on Travel Time Prediction Model of Freeway Based on Gradient Boosting Decision Tree.,IEEE Access
A Modified GLT Double Faults Isolation Approach Based on MLE and RPV for Six-Gyro Redundant SINS.,IEEE Access
Optimal Planning of Multi-Energy System Considering Thermal Storage Capacity of Heating Network and Heat Load.,IEEE Access
Health Status Prediction Based on Belief Rule Base for High-Speed Train Running Gear System.,IEEE Access
Ego-Lane Position Identification With Event Warning Applications.,IEEE Access
The Installation Performance Control of Three Ducts Separate Exhaust Variable Cycle Engine.,IEEE Access
Lag Exponential Synchronization of Delayed Memristor-Based Neural Networks via Robust Analysis.,IEEE Access
Not in My Neighborhood - A User Equipment Perspective of Cellular Planning Under Restrictive EMF Limits.,IEEE Access
Application of Instance-Based Entropy Fuzzy Support Vector Machine in Peer-To-Peer Lending Investment Decision.,IEEE Access
Multistage Fusion With Dissimilarity Regularization for SAR/IR Target Recognition.,IEEE Access
A Self-Organized Task Distribution Framework for Module-Based Event Stream Processing.,IEEE Access
Analysing the Dynamics of Interbeat Interval Time Series Using Grouped Horizontal Visibility Graph.,IEEE Access
Reference Layer Artefact Subtraction (RLAS) - Electromagnetic Simulations.,IEEE Access
Prior Image Induced Regularization Method for Electrical Capacitance Tomography.,IEEE Access
Generative Adversarial Network-Based Method for Transforming Single RGB Image Into 3D Point Cloud.,IEEE Access
220-320 GHz Hemispherical Lens Antennas Using Digital Light Processed Photopolymers.,IEEE Access
Patient-Provider Interaction System for Efficient Home-Based Cardiac Rehabilitation Exercise.,IEEE Access
Big Data Driven Oriented Graph Theory Aided tagSNPs Selection for Genetic Precision Therapy.,IEEE Access
MA-Shape - Modality Adaptation Shape Regression for Left Ventricle Segmentation on Mixed MR and CT Images.,IEEE Access
Protective Performance of Different Passivators on Oil-Paper Insulation Containing Multiple Corrosive Sulphides.,IEEE Access
A Scalable Approach for 360° Feedback in Cooperative Learning.,IEEE Access
A Study on the Suitability of Visual Languages for Non-Expert Robot Programmers.,IEEE Access
A Review of the Analytics Techniques for an Efficient Management of Online Forums - An Architecture Proposal.,IEEE Access
Empirical Rates Characterization of Wearable Multi-Antenna Terminals for First-Responders.,IEEE Access
Automated Optimization of Intersections Using a Genetic Algorithm.,IEEE Access
Hard Sample Mining and Learning for Skeleton-Based Human Action Recognition and Identification.,IEEE Access
On-Chip Optical Vector Quadrature De-Multiplexer Proposal for QAM De-Aggregation by Single Bi-Directional SOA-Based Phase-Sensitive Amplifier.,IEEE Access
WSN-Based Measurement of Ion-Current Density Under High-Voltage Direct Current Transmission Lines.,IEEE Access
Limited-View Cone-Beam CT Reconstruction Based on an Adversarial Autoencoder Network With Joint Loss.,IEEE Access
Neurosurgical Craniotomy Localization Using Interactive 3D Lesion Mapping for Image-Guided Neurosurgery.,IEEE Access
Joint Model Feature Regression and Topic Learning for Global Citation Recommendation.,IEEE Access
Evaluation of SPN-Based Lightweight Crypto-Ciphers.,IEEE Access
A Simple and Robust Sensorless Control Based on Stator Current Vector for PMSG Wind Power Systems.,IEEE Access
Edge Odd Graceful Labeling of Cylinder and Torus Grid Graphs.,IEEE Access
Zero-/Low-Speed Operation of Multiphase Drive Systems With Modular Multilevel Converters.,IEEE Access
A Robust Calibration Method for Consumer Grade RGB-D Sensors for Precise Indoor Reconstruction.,IEEE Access
All Passive Realization of Lossy Coupling Matrices Using Resistive Decomposition Technique.,IEEE Access
Grid Ancillary Services From Doubly Fed Induction Generator-Based Wind Energy Conversion System - A Review.,IEEE Access
Hierarchical Verification for the BPMN Design Model Using State Space Analysis.,IEEE Access
The Feasibility of Automated Identification of Six Algae Types Using Feed-Forward Neural Networks and Fluorescence-Based Spectral-Morphological Features.,IEEE Access
An End-to-End Multi-Task and Fusion CNN for Inertial-Based Gait Recognition.,IEEE Access
Task Scheduling for Smart City Applications Based on Multi-Server Mobile Edge Computing.,IEEE Access
cGAN Based Facial Expression Recognition for Human-Robot Interaction.,IEEE Access
Time-Varying Social-Aware Resource Allocation for Device-to-Device Communication.,IEEE Access
Performance Investigation of Three-Phase Three-Switch Direct PWM AC/AC Voltage Converters.,IEEE Access
Direct Adaptive Neural Control Design for a Class of Nonlinear Multi Input Multi Output Systems.,IEEE Access
Development of Super-Resolution Sharpness-Based Axial Localization for Ultrasound Imaging.,IEEE Access
Joint Computing Resource, Power, and Channel Allocations for D2D-Assisted and NOMA-Based Mobile Edge Computing.,IEEE Access
The Internet of Things - A Review of Enabled Technologies and Future Challenges.,IEEE Access
IT2-Based Fuzzy Hybrid Decision Making Approach to Soft Computing.,IEEE Access
Combining Adaptive Hierarchical Depth Motion Maps With Skeletal Joints for Human Action Recognition.,IEEE Access
Performance Analysis of Mixed-ADC Massive MIMO Systems Over Spatially Correlated Channels.,IEEE Access
Stability Analysis of Boolean Networks With Stochastic Function Perturbations.,IEEE Access
A Multidimensional Cadastral Topological Data Model - Design and Implementation.,IEEE Access
Design of Reconfigurable Planar Micro-Positioning Stages Based on Function Modules.,IEEE Access
An Energy Efficient Integration Model for Sensor Cloud Systems.,IEEE Access
Adapted K-Nearest Neighbors for Detecting Anomalies on Spatio-Temporal Traffic Flow.,IEEE Access
A Survey on Urban Traffic Anomalies Detection Algorithms.,IEEE Access
Efficient and Accurate Detection and Frequency Estimation of Multiple Sinusoids.,IEEE Access
Visible Light Communication-Based Vehicle-to-Vehicle Tracking Using CMOS Camera.,IEEE Access
Compact UWB Antenna With Integrated Triple Notch Bands for WBAN Applications.,IEEE Access
Heading Control of Unmanned Marine Vehicles Based on an Improved Robust Adaptive Fuzzy Neural Network Control Algorithm.,IEEE Access
