Wideband Low-Profile Printed Dipole Antenna Incorporated With Folded Strips and Corner-Cut Parasitic Patches Above the Ground Plane.,IEEE Access
Evolving Rule-Based Explainable Artificial Intelligence for Unmanned Aerial Vehicles.,IEEE Access
Enhanced Virtual Inertia Control Based on Derivative Technique to Emulate Simultaneous Inertia and Damping Properties for Microgrid Frequency Regulation.,IEEE Access
Sound Classification Using Convolutional Neural Network and Tensor Deep Stacking Network.,IEEE Access
Moth Flame Clustering Algorithm for Internet of Vehicle (MFCA-IoV).,IEEE Access
A Novel Cryptographic Substitution Box Design Using Gaussian Distribution.,IEEE Access
Two-Level Cluster Based Routing Scheme for 5G V2X Communication.,IEEE Access
Formal Analysis of Language-Based Android Security Using Theorem Proving Approach.,IEEE Access
One Size Does Not Fit All - Querying Web Polystores.,IEEE Access
Efficient Algorithm for Multi-Bit Montgomery Inverse Using Refined Multiplicative Inverse Modular 2K.,IEEE Access
Cancelable ECG Biometrics Using Compressive Sensing-Generalized Likelihood Ratio Test.,IEEE Access
Improving Spatial Locality in Virtual Machine for Flash Storage.,IEEE Access
Feasibility of Index-Coded Retransmissions for Enhancing Sidelink Channel Efficiency of V2X Communications.,IEEE Access
Fast Pedestrian Detection in Surveillance Video Based on Soft Target Training of Shallow Random Forest.,IEEE Access
Power Factor Control Method Based on Virtual Capacitors for Three-Phase Matrix Rectifiers.,IEEE Access
Markov Chain Hebbian Learning Algorithm With Ternary Synaptic Units.,IEEE Access
Compensation of Parameter Uncertainty Using an Adaptive Sliding Mode Control Strategy for an Interior Permanent Magnet Synchronous Motor Drive.,IEEE Access
Intelligent Health Diagnosis Technique Exploiting Automatic Ontology Generation and Web-Based Personal Health Record Services.,IEEE Access
The Development of an IoT-Based Educational Simulator for Dental Radiography.,IEEE Access
Epsim - A Scalable and Parallel Marssx86 Simulator With Exploiting Epoch-Based Execution.,IEEE Access
The Impact of Math Anxiety on Working Memory - A Cortical Activations and Cortical Functional Connectivity EEG Study.,IEEE Access
Uplink Time Scheduling With Power Level Modulation Scheme in Wireless Powered Communication Networks.,IEEE Access
Buffering Time for Wireless Full-Duplex Systems Under Random Arrival.,IEEE Access
New Normal Parameter Reduction Method in Fuzzy Soft Set Theory.,IEEE Access
Human Interactive Behavior - A Bibliographic Review.,IEEE Access
Raccoon Optimization Algorithm.,IEEE Access
Modeling Opinion of IPTV Viewers Based on Implicit Feedback and Content Metadata.,IEEE Access
FPGA Acceleration for Computationally Efficient Symbol-Level Precoding in Multi-User Multi-Antenna Communication Systems.,IEEE Access
Fast HEVC to SCC Transcoder by Early CU Partitioning Termination and Decision Tree-Based Flexible Mode Decision for Intra-Frame Coding.,IEEE Access
A Technology Mapping of FSMs Based on a Graph of Excitations and Outputs.,IEEE Access
Energy Efficient Scheduling in Wireless Sensor Networks for Periodic Data Gathering.,IEEE Access
Analysis and Optimization of Unmanned Aerial Vehicle Swarms in Logistics - An Intelligent Delivery Platform.,IEEE Access
A Compact Integration of a 77 GHz FMCW Radar System Using CMOS Transmitter and Receiver Adopting On-Chip Monopole Feeder.,IEEE Access
Mandelbrot and Julia Sets via Jungck-CR Iteration With s-Convexity.,IEEE Access
Spatiotemporal Adaptive Nonuniformity Correction Based on BTV Regularization.,IEEE Access
Robust Locally Discriminant Analysis via Capped Norm.,IEEE Access
A Clustering-Based Energy Saving Scheme for Dense Small Cell Networks.,IEEE Access
Adaptive MIMO Detector Using Reduced Search Space and Its Error Rate Estimator in Ultra Dense Network.,IEEE Access
Signal Processing on Static and Dynamic 3D Meshes - Sparse Representations and Applications.,IEEE Access
Latency Analysis of Wireless Networks for Proximity Services in Smart Home and Building Automation - The Case of Thread.,IEEE Access
Scoreboard Architectural Pattern and Integration of Emotion Recognition Results.,IEEE Access
Declarative Specification of Bidirectional Transformations Using Design Patterns.,IEEE Access
Enhanced MR Image Classification Using Hybrid Statistical and Wavelets Features.,IEEE Access
Self-Organizing Recurrent Interval Type-2 Petri Fuzzy Design for Time-Varying Delay Systems.,IEEE Access
Defining a Reliable Network Topology in Software-Defined Power Substations.,IEEE Access
Enhanced Path Detection Based on Interference Cancellation for Range Estimation of Communication-Based Positioning System in Indoor Environment.,IEEE Access
Active Interference Cancellation for Full-Duplex Multiuser Networks With or Without Existence of Self-Interference.,IEEE Access
A Suboptimal Approach to Antenna Design Problems With Kernel Regression.,IEEE Access
Voltage Balancing Control of IPOS Modular Dual Active Bridge DC/DC Converters Based on Hierarchical Sliding Mode Control.,IEEE Access
Multiple Object Tracking via Feature Pyramid Siamese Networks.,IEEE Access
Sampling Operator to Learn the Scalable Correlation Filter for Visual Tracking.,IEEE Access
Time Estimation and Resource Minimization Scheme for Apache Spark and Hadoop Big Data Systems With Failures.,IEEE Access
RLizard - Post-Quantum Key Encapsulation Mechanism for IoT Devices.,IEEE Access
HW-CDI - Hard-Wired Control Data Integrity.,IEEE Access
An Easy Network Onboarding Scheme for Internet of Things Networks.,IEEE Access
A Chopper Stabilized Current-Feedback Instrumentation Amplifier for EEG Acquisition Applications.,IEEE Access
Non-Ionized, High-Resolution Measurement of Internal and Marginal Discrepancies of Dental Prosthesis Using Optical Coherence Tomography.,IEEE Access
A Noise-Acceptable ZNN for Computing Complex-Valued Time-Dependent Matrix Pseudoinverse.,IEEE Access
Adversarial Knowledge Representation Learning Without External Model.,IEEE Access
A Differentiated Reservation MAC Protocol for Achieving Fairness and Efficiency in Multi-Rate IEEE 802.11 WLANs.,IEEE Access
Detection of Sound Field Aberrations Caused by Forward Scattering From Underwater Intruders Using Unsupervised Machine Learning.,IEEE Access
Local Feature Descriptor for Image Matching - A Survey.,IEEE Access
Optimal Power and Performance Management for Heterogeneous and Arbitrary Cloud Servers.,IEEE Access
Supervised Saliency Mapping for First-Person Videos With an Inverse Sparse Coding Framework.,IEEE Access
On the Modeling of Near-Field Scattering of Vehicles in Vehicle-to-X Wireless Channels Based on Scattering Centers.,IEEE Access
Multi-Synchronization of Stochastic Coupled Multi-Stable Neural Networks With Time-Varying Delay by Impulsive Control.,IEEE Access
Single Flip-Chip Packaged Dielectric Resonator Antenna for CMOS Terahertz Antenna Array Gain Enhancement.,IEEE Access
IT Outsourcing Auctions With Bilateral Efforts and Renegotiation.,IEEE Access
A New Lattice-Based Signature Scheme in Post-Quantum Blockchain Network.,IEEE Access
A Method of Emergent Event Evolution Reasoning Based on Ontology Cluster and Bayesian Network.,IEEE Access
Fuzzy Fault Detection Filter Design for Nonlinear Distributed Parameter Systems.,IEEE Access
Sparse Representation Based on the Analysis Model With Optimization on the Stiefel Manifold.,IEEE Access
SLA-Aware and Energy-Efficient VM Consolidation in Cloud Data Centers Using Robust Linear Regression Prediction Model.,IEEE Access
A New RSS Fingerprinting-Based Location Discovery Method Under Sparse Reference Point Conditions.,IEEE Access
Mining Dynamics of Research Topics Based on the Combined LDA and WordNet.,IEEE Access
Do Google App Engine&apos;s Runtimes Perform Homogeneously? An Empirical Investigation for Bonus Computing.,IEEE Access
Resource Allocation and Task Offloading for Heterogeneous Real-Time Tasks With Uncertain Duration Time in a Fog Queueing System.,IEEE Access
Sparse Bayesian Learning Based Space-Time Adaptive Processing Against Unknown Mutual Coupling for Airborne Radar Using Middle Subarray.,IEEE Access
EEG-Based Mild Depressive Detection Using Differential Evolution.,IEEE Access
Human Lesion Detection Method Based on Image Information and Brain Signal.,IEEE Access
Deterministic Quantum Secure Direct Communication Protocol Based on Omega State.,IEEE Access
Optimal Dual Frames for Probabilistic Erasures.,IEEE Access
Efficient CCA2 Secure Flexible and Publicly-Verifiable Fine-Grained Access Control in Fog Computing.,IEEE Access
Image Classification Using Low-Rank Regularized Extreme Learning Machine.,IEEE Access
Optimal Node Attack on Causality Analysis in Cyber-Physical Systems - A Data-Driven Approach.,IEEE Access
AC Grids Characteristics Oriented Multi-Point Voltage Coordinated Control Strategy for VSC-MTDC.,IEEE Access
Design and Implementation of Networked Collaborative Service System for Brain Stroke Prevention and First Aid.,IEEE Access
Complex Attack Linkage Decision-Making in Edge Computing Networks.,IEEE Access
Approximate Computing With Stochastic Transistors&apos; Voltage Over-Scaling.,IEEE Access
Optimizing the Coverage via the UAVs With Lower Costs for Information-Centric Internet of Things.,IEEE Access
TT-Miner - Topology-Transaction Miner for Mining Closed Itemset.,IEEE Access
A Novel Approach to Rule Placement in Software-Defined Networks Based on OPTree.,IEEE Access
Brain Computer Interface for Neurodegenerative Person Using Electroencephalogram.,IEEE Access
Service Migration in Fog Computing Enabled Cellular Networks to Support Real-Time Vehicular Communications.,IEEE Access
Robust Hierarchical Learning for Non-Negative Matrix Factorization With Outliers.,IEEE Access
An Indoor Positioning Error Correction Method of Pedestrian Multi-Motions Recognized by Hybrid-Orders Fraction Domain Transformation.,IEEE Access
Fog Radio Access Network - A New Wireless Backhaul Architecture for Small Cell Networks.,IEEE Access
A Concept Map-Based Learning Paths Automatic Generation Algorithm for Adaptive Learning Systems.,IEEE Access
Adaptive Differential Evolution With Evolution Memory for Multiobjective Optimization.,IEEE Access
Energy-Aware Mobile Edge Computation Offloading for IoT Over Heterogenous Networks.,IEEE Access
False Data Injection Attacks With Incomplete Network Topology Information in Smart Grid.,IEEE Access
Similarity Measure Based on Incremental Warping Window for Time Series Data Mining.,IEEE Access
Controlled Islanding for a Hybrid AC/DC Grid With VSC-HVDC Using Semi-Supervised Spectral Clustering.,IEEE Access
RMVP - A Real-Time Method to Monitor Random Processes of Virtual Machine.,IEEE Access
Path Planning Technologies for Autonomous Underwater Vehicles-A Review.,IEEE Access
Multiscale Quantum Harmonic Oscillator Algorithm With Strict Metastability Constraints for Multi-Modal Optimization.,IEEE Access
Enhancing Cloud-Based IoT Security Through Trustworthy Cloud Service - An Integration of Security and Reputation Approach.,IEEE Access
L21-Norm Based Loss Function and Regularization Extreme Learning Machine.,IEEE Access
Collective Efficacy of Support Vector Regression With Smoothness Priority in Marine Sensor Data Prediction.,IEEE Access
Robust Nonlinear Controller Design for Damping of Sub-Synchronous Control Interaction in DFIG-Based Wind Farms.,IEEE Access
RMapTAFA - Radio Map Construction Based on Trajectory Adjustment and Fingerprint Amendment.,IEEE Access
Energy Efficiency Optimization of Distributed Massive MIMO Systems Under Ergodic QoS and Per-RAU Power Constraints.,IEEE Access
Vehicle Stability Control Based on Model Predictive Control Considering the Changing Trend of Tire Force Over the Prediction Horizon.,IEEE Access
Time+User Dual Attention Based Sentiment Prediction for Multiple Social Network Texts With Time Series.,IEEE Access
Surface Charge Transport Characteristics of ZnO/Silicone Rubber Composites Under Impulse Superimposed on DC Voltage.,IEEE Access
Adaptive Prescribed Performance Fault Estimation and Accommodation for a Class of Stochastic Nonlinear Systems.,IEEE Access
Naïve Bayes Classifier-Assisted Least Loaded Routing for Circuit-Switched Networks.,IEEE Access
A Community Merger of Optimization Algorithm to Extract Overlapping Communities in Networks.,IEEE Access
An Effective Algorithm for Delay Fractional Convection-Diffusion Wave Equation Based on Reversible Exponential Recovery Method.,IEEE Access
D2D-Assisted Caching on Truncated Zipf Distribution.,IEEE Access
Efficient Laser-Based 3D SLAM for Coal Mine Rescue Robots.,IEEE Access
Adaptive Sample Weight for Machine Learning Computer Vision Algorithms in V2X Systems.,IEEE Access
Lithium-Ion Battery State of Health Monitoring Based on Ensemble Learning.,IEEE Access
Modified Grasshopper Algorithm-Based Multilevel Thresholding for Color Image Segmentation.,IEEE Access
Online Computing Quantile Summaries Over Uncertain Data Streams.,IEEE Access
Research on Recognition of Nine Kinds of Fine Gestures Based on Adaptive AdaBoost Algorithm and Multi-Feature Combination.,IEEE Access
Fog-Enabled Vehicle as a Service for Computing Geographical Migration in Smart Cities.,IEEE Access
New Stability Criteria of Discrete Systems With Time-Varying Delays.,IEEE Access
Cooperative NOMA System With Virtual Full Duplex User Relaying.,IEEE Access
Latency-Optimal mmWave Radio Access for V2X Supporting Next Generation Driving Use Cases.,IEEE Access
The Structure-Behavior Coalescence Approach for Systems Modeling.,IEEE Access
Efficient Fault-Tolerant Routing in IoT Wireless Sensor Networks Based on Bipartite-Flow Graph Modeling.,IEEE Access
Reducing Signal Overload by Disconnection Tolerant Voice Service in Heterogeneous Networks.,IEEE Access
Fourier Dense Network to Conduct Plant Classification Using UAV-Based Optical Images.,IEEE Access
An Ultra-Wideband Reflective Phase Gradient Metasurface Using Pancharatnam-Berry Phase.,IEEE Access
Binary Data Gathering With a Helper in Internet of Things - Distortion Analysis and Performance Evaluation.,IEEE Access
P4-TPG - Accelerating Deterministic Parallel Test Pattern Generation by Preemptive, Proactive, and Preventive Schedulings.,IEEE Access
Recurrent Models of Visual Co-Attention for Person Re-Identification.,IEEE Access
Echo - An Edge-Centric Code Offloading System With Quality of Service Guarantee.,IEEE Access
A Unified Matrix-Based Convolutional Neural Network for Fine-Grained Image Classification of Wheat Leaf Diseases.,IEEE Access
Social Network Rumor Diffusion Predication Based on Equal Responsibility Game Model.,IEEE Access
The Challenges of Existence, Status, and Value for Improving Blockchain.,IEEE Access
Distributed Multi-Channel MAC Protocol for VANET - An Adaptive Frame Structure Scheme.,IEEE Access
Domain-RIP Analysis - A Technique for Analyzing Mutation Stubbornness.,IEEE Access
Rayleigh Fading Suppression in One-Dimensional Optical Scatters.,IEEE Access
A Precise and Stable Segmentation Algorithm of SAR Images Based on Random Weighting Method and Modified Level Set.,IEEE Access
Vibration Detection of Spanning Subsea Pipelines by Using a Spherical Detector.,IEEE Access
Performance Analysis and Transceiver Design of Few-Bit Quantized MIMO Systems.,IEEE Access
Blockchain Radio Access Network (B-RAN) - Towards Decentralized Secure Radio Access Paradigm.,IEEE Access
Semi-Supervised Automatic Segmentation of Layer and Fluid Region in Retinal Optical Coherence Tomography Images Using Adversarial Learning.,IEEE Access
Big Medical Data Decision-Making Intelligent System Exploiting Fuzzy Inference Logic for Prostate Cancer in Developing Countries.,IEEE Access
Damage Characteristics and Microstructure Response of Steel Alloy Q235B Subjected to Simulated Lightning Currents.,IEEE Access
Quantitative Analysis of Blood Flow in Cerebral Venous Sinus With Stenosis by Patient-Specific CFD Modeling.,IEEE Access
Face Alignment via Multi-Regressors Collaborative Optimization.,IEEE Access
Multiplexed OAM Wave Communication With Two-OAM-Mode Antenna Systems.,IEEE Access
A Meta-Surface Decoupling Method for Two Linear Polarized Antenna Array in Sub-6 GHz Base Station Applications.,IEEE Access
Spatiotemporal Relation Networks for Video Action Recognition.,IEEE Access
A Novel Inertia Identification Method and Its Application in PI Controllers of PMSM Drives.,IEEE Access
Empirical Frequency-Dependent Wall Insertion Loss Model at 3-6 GHz for Future Internet-of-Things Applications.,IEEE Access
An Iterative Reputation Ranking Method via the Beta Probability Distribution.,IEEE Access
Automatic Face Recognition Based on Sparse Representation and Extended Transfer Learning.,IEEE Access
A Cohesion-Based Heuristic Feature Selection for Short-Term Traffic Forecasting.,IEEE Access
Optimization of the Load Balancing Policy for Tiled Many-Core Processors.,IEEE Access
Dynamic Behavior of Droplets and Flashover Characteristics for CFD and Experimental Analysis on SiR Composites.,IEEE Access
Global μ-Stability of Quaternion-Valued Neural Networks With Unbounded and Asynchronous Time-Varying Delays.,IEEE Access
Altitude Control for Variable Load Quadrotor via Learning Rate Based Robust Sliding Mode Controller.,IEEE Access
Information Recommendation Based on Domain Knowledge in App Descriptions for Improving the Quality of Requirements.,IEEE Access
Blind Stereoscopic Image Quality Assessment Based on Hierarchical Learning.,IEEE Access
2D Image Deformation Based on Guaranteed Feature Correspondence and Mesh Mapping.,IEEE Access
An Attribute-Based High-Level Image Representation for Scene Classification.,IEEE Access
A New Learning Approach to Malware Classification Using Discriminative Feature Extraction.,IEEE Access
Fault-Tolerant Adaptive Control for a Class of Nonlinear Systems With Uncertain Parameters and Unknown Control Directions.,IEEE Access
Detection and Pose Estimation for Short-Range Vision-Based Underwater Docking.,IEEE Access
A Fuzzy Reasoning Model for Cervical Intraepithelial Neoplasia Classification Using Temporal Grayscale Change and Textures of Cervical Images During Acetic Acid Tests.,IEEE Access
Recurrent Conditional Generative Adversarial Network for Image Deblurring.,IEEE Access
Toward Device-Free Micro-Gesture Tracking via Accurate Acoustic Doppler-Shift Detection.,IEEE Access
Angular Motion Decoupling and Attitude Determination Based on High Dynamic Gyro.,IEEE Access
Single-Phase Inverter With Wide Input Voltage and Power Decoupling Capability.,IEEE Access
A Unified Variational Model for Single Image Dehazing.,IEEE Access
Analysis and Accurate Prediction of User&apos;s Response Behavior in Incentive-Based Demand Response.,IEEE Access
Decentralized Voltage and Power Control of Multi-Machine Power Systems With Global Asymptotic Stability.,IEEE Access
Regulated State Synchronization of Homogeneous Discrete-Time Multi-Agent Systems via Partial State Coupling in Presence of Unknown Communication Delays.,IEEE Access
QoE-Oriented Rate Adaptation for DASH With Enhanced Deep Q-Learning.,IEEE Access
A Numerical-Based Attention Method for Stock Market Prediction With Dual Information.,IEEE Access
A Two-Stage Energy-Efficient Approach for Joint Power Control and Channel Allocation in D2D Communication.,IEEE Access
Proximity Effects of Lateral Conductivity Variations on Geomagnetically Induced Electric Fields.,IEEE Access
Planning of Multi Energy-Type Micro Energy Grid Based on Improved Kriging Model.,IEEE Access
Secure and Efficient Multi-Authority Attribute-Based Encryption Scheme From Lattices.,IEEE Access
Energy Efficient Downlink Resource Allocation for D2D-Assisted Cellular Networks With Mobile Edge Caching.,IEEE Access
Directional Modulation Technique for Linear Sparse Arrays.,IEEE Access
Improved Polar SCL Decoding by Exploiting the Error Correction Capability of CRC.,IEEE Access
Low-Rank Phase Retrieval via Variational Bayesian Learning.,IEEE Access
Effects of Lateral Conductivity Variations on Geomagnetically Induced Currents - H-Polarization.,IEEE Access
Quantum Image Encryption Using Intra and Inter Bit Permutation Based on Logistic Map.,IEEE Access
Jointly Optimized Energy-Minimal Resource Allocation in Cache-Enhanced Mobile Edge Computing Systems.,IEEE Access
Multi-Attribute Group Decision Making Based on Intuitionistic Uncertain Linguistic Hamy Mean Operators With Linguistic Scale Functions and Its Application to Health-Care Waste Treatment Technology Selection.,IEEE Access
Brain Image Segmentation Based on Multi-Weight Probability Map.,IEEE Access
Image Denoising via Nonlocal Low Rank Approximation With Local Structure Preserving.,IEEE Access
Code-Partitioning Offloading Schemes in Mobile Edge Computing for Augmented Reality.,IEEE Access
Unmanned Water-Powered Aerial Vehicles - Theory and Experiments.,IEEE Access
Analysis of a Packable and Tunable Origami Multi-Radii Helical Antenna.,IEEE Access
A Novel Region-Refinement Pulse Width Modulation Method for Torque Ripple Reduction of Brushless DC Motors.,IEEE Access
Modeling of Structure Landmark for Indoor Pedestrian Localization.,IEEE Access
Mass Spectral Substance Detections Using Long Short-Term Memory Networks.,IEEE Access
2-D DOA Robust Estimation of Echo Signals Based on Multiple Satellites Passive Radar in the Presence of Alpha Stable Distribution Noise.,IEEE Access
Tracking Algorithms Aided by the Pose of Target.,IEEE Access
A Power Distribution Control Strategy Between Energy Storage Elements and Capacitors for Cascaded Multilevel Inverter With Hybrid Energy Sources.,IEEE Access
Transcriptome Comparisons of Multi-Species Identify Differential Genome Activation of Mammals Embryogenesis.,IEEE Access
Recurrent Neural Networks With Finite Memory Length.,IEEE Access
Updating Dynamic Noise Models With Moving Magnetoencephalographic (MEG) Systems.,IEEE Access
Multi-Objective Optimization-Based Real-Time Control Strategy for Battery/Ultracapacitor Hybrid Energy Management Systems.,IEEE Access
Improved Hybrid Precoding Scheme for mmWave Large-Scale MIMO Systems.,IEEE Access
Robust H∞ Control of Lurie Nonlinear Stochastic Network Control Systems With Multiple Additive Time-Varying Delay Components.,IEEE Access
Secure Dynamic Big Graph Data - Scalable, Low-Cost Remote Data Integrity Checking.,IEEE Access
Bi-Population Based Discrete Bat Algorithm for the Low-Carbon Job Shop Scheduling Problem.,IEEE Access
Physical Layer Encryption Algorithm Based on Polar Codes and Chaotic Sequences.,IEEE Access
Determining the Required Probe Vehicle Size for Real-Time Travel Time Estimation on Signalized Arterial.,IEEE Access
Collapsed VBI-DP Based Structured Sparse Channel Estimation Algorithm for Massive MIMO-OFDM.,IEEE Access
Mobile Sink-Based Path Optimization Strategy in Wireless Sensor Networks Using Artificial Bee Colony Algorithm.,IEEE Access
A Highly Efficient Multifunctional Power Electronic Interface for PEV Hybrid Energy Management Systems.,IEEE Access
Indoor Collaborative Positioning With Adaptive Particle-Pair Filtering Based on Dynamic User Pairing.,IEEE Access
Harnessing Commodity Wearable Devices to Capture Learner Engagement.,IEEE Access
A Switching Approach to Packet Loss Compensation Strategy.,IEEE Access
Synthesis of a Dynamical Output H∞ Controller for the Fuzzy Input-Output Model.,IEEE Access
A Hardware-Efficient Recognition Accelerator Using Haar-Like Feature and SVM Classifier.,IEEE Access
Trace Ratio Criterion Based Large Margin Subspace Learning for Feature Selection.,IEEE Access
Cone-Beam Computed Tomography Deblurring Using an Overrelaxed Chambolle-Pock Algorithm.,IEEE Access
Dual-Domain Audio Watermarking Algorithm Based on Flexible Segmentation and Adaptive Embedding.,IEEE Access
Joint Optimization of Area Spectral Efficiency and Energy Efficiency for Two-Tier Heterogeneous Ultra-Dense Networks.,IEEE Access
Unsupervised Band Selection Method Based on Importance-Assisted Column Subset Selection.,IEEE Access
A Deep Learning-Based Approach to Power Minimization in Multi-Carrier NOMA With SWIPT.,IEEE Access
A Specification-Based Semi-Formal Functional Verification Method by a Stage Transition Graph Model.,IEEE Access
Channel Prediction for Millimeter Wave MIMO-OFDM Communications in Rapidly Time-Varying Frequency-Selective Fading Channels.,IEEE Access
Interest-Related Item Similarity Model Based on Multimodal Data for Top-N Recommendation.,IEEE Access
Research on Big Data Security Storage Based on Compressed Sensing.,IEEE Access
An Image Processing Approach to Measuring the Sphericity and Roundness of Fracturing Proppants.,IEEE Access
MT-DMA - A DMA Controller Supporting Efficient Matrix Transposition for Digital Signal Processing.,IEEE Access
Discovering Suspicious APT Families Through a Large-Scale Domain Graph in Information-Centric IoT.,IEEE Access
Video Summarization via Nonlinear Sparse Dictionary Selection.,IEEE Access
Fixing and Aligning Methods for Dielectric Resonator Antennas in K Band and Beyond.,IEEE Access
Integrating Economic Model Predictive Control and Event-Triggered Control - Application to Bi-Hormonal Artificial Pancreas System.,IEEE Access
A Comparative Study of Aggressive Driving Behavior Recognition Algorithms Based on Vehicle Motion Data.,IEEE Access
Web News Mining Using New Features - A Comparative Study.,IEEE Access
Machine Learning Approach-Based Gamma Distribution for Brain Tumor Detection and Data Sample Imbalance Analysis.,IEEE Access
A Security-Enhanced Cluster Size Adjustment Scheme for Cognitive Radio Networks.,IEEE Access
Learning to Fuse Multiscale Features for Visual Place Recognition.,IEEE Access
Imbalanced Fault Diagnosis of Rolling Bearing Based on Generative Adversarial Network - A Comparative Study.,IEEE Access
Power Minimization Resource Allocation for Underlay MISO-NOMA SWIPT Systems.,IEEE Access
Synchronization Mechanisms for Multi-User and Multi-Device Hybrid Broadcast and Broadband Distributed Scenarios.,IEEE Access
