An Efficient Deadlock Recovery Policy for Flexible Manufacturing Systems Modeled With Petri Nets.,IEEE Access
Integrating Social Homophily and Network Lasso for Personalized Sentiment Classification.,IEEE Access
Local Descriptor Learning for Change Detection in Synthetic Aperture Radar Images via Convolutional Neural Networks.,IEEE Access
A Compact Single-Layer Ultra-Wideband Phase Shifter Using Weakly Coupled Lines.,IEEE Access
An Improved Hyperspectral Pansharpening Algorithm Based on Optimized Injection Model.,IEEE Access
The Sensitivity Design of Piezoresistive Acceleration Sensor in Industrial IoT.,IEEE Access
Tuning the Aggressive Slow-Start Behavior of MPTCP for Short Flows.,IEEE Access
Understanding Time-Based Trends in Stakeholders&apos; Choice of Learning Activity Type Using Predictive Models.,IEEE Access
Weakly Supervised Deep Depth Prediction Leveraging Ground Control Points for Guidance.,IEEE Access
Adaptive Robust Control of Multi-Axle Vehicle Electro-Hydraulic Power Steering System With Uncertain Tire Steering Resistance Moment.,IEEE Access
Oil-in-Water Two-Phase Flow Pattern Identification From Experimental Snapshots Using Convolutional Neural Network.,IEEE Access
Unified Subspace Fitting Framework and Its Performance Analysis for Direct Position Determination in the Presence of Multipath Propagation.,IEEE Access
Analysis of the Factors Affecting Airborne Digital Sensor Image Quality.,IEEE Access
Reversible Image Steganography Scheme Based on a U-Net Structure.,IEEE Access
Research on the Isolation and Collection Method of Multi-Channel Temperature and Power Supply Voltage Under Strong Marine Controlled Source EMI.,IEEE Access
Terahertz Dielectric Property Characterization of Photopolymers for Additive Manufacturing.,IEEE Access
Algorithms for Automatic Analysis and Classification of Heart Sounds-A Systematic Review.,IEEE Access
Differential Cryptanalysis of Round-Reduced SPECK Suitable for Internet of Things Devices.,IEEE Access
Development of a Mobile Game Application to Boost Students&apos; Motivation in Learning English Vocabulary.,IEEE Access
An Unsupervised Reconstruction-Based Fault Detection Algorithm for Maritime Components.,IEEE Access
Semi-Supervised Learning With Deep Embedded Clustering for Image Classification and Segmentation.,IEEE Access
Comparative Study of Inkjet-Printed Silver Conductive Traces With Thermal and Electrical Sintering.,IEEE Access
Effective Fat Quantification Using Multiple Region Growing Scheme at High-Field MRI.,IEEE Access
A Scalable Indirect Position-Based Causal Diffusion Protocol for Vehicular Networks.,IEEE Access
Rectangular Dielectric Resonator Antenna With Corrugated Walls.,IEEE Access
A Survey of Stereoscopic 3D Just Noticeable Difference Models.,IEEE Access
Kinematic Analysis of Trajectory Dimension-Dependent Sensorimotor Control in Arm Tracking.,IEEE Access
Designing Constant-Envelope Transmissions for Secret Communications in MISO Wiretap Channels.,IEEE Access
Secure Wireless Information and Power Transfer Based on Tilt Adaptation in 3-D Massive MIMO Systems.,IEEE Access
Damping Rotating Grid SINS Based on a Kalman Filter for Shipborne Application.,IEEE Access
AC Flashover Performance of FRP Hot Stick for Live Working in High Altitude Areas.,IEEE Access
FETMS - Fast and Efficient Trust Management Scheme for Information-Centric Networking in Internet of Things.,IEEE Access
Edge Cache-Based ISP-CP Collaboration Scheme for Content Delivery Services.,IEEE Access
Block-Based Optical Color Image Encryption Based on Double Random Phase Encoding.,IEEE Access
Comments on &quot;Stability, l2-Gain, and Robust H∞ Control for Switched Systems via N-Step-Ahead Lyapunov Function Approach&quot;.,IEEE Access
SPADE - Activity Prediction in Smart Homes Using Prefix Tree Based Context Generation.,IEEE Access
Composition of Partially-Observable Services.,IEEE Access
Linear-Time Algorithm for Learning Large-Scale Sparse Graphical Models.,IEEE Access
Directional Receivers for Diffusion-Based Molecular Communications.,IEEE Access
A Conformal Magneto-Electric Dipole Antenna With Wide H-Plane and Band-Notch Radiation Characteristics for Sub-6-GHz 5G Base-Station.,IEEE Access
Cryptanalysis and Improvement of the Image Encryption Scheme Based on 2D Logistic-Adjusted-Sine Map.,IEEE Access
Private Data Acquisition Method Based on System-Level Data Migration and Volatile Memory Forensics for Android Applications.,IEEE Access
Power Control in Relay-Assisted Anti-Jamming Systems - A Bayesian Three-Layer Stackelberg Game Approach.,IEEE Access
Novel Broadband Bow-Tie Antenna Based on Complementary Split-Ring Resonators Enhanced Substrate-Integrated Waveguide.,IEEE Access
An Energy-Efficient and Fast Convergent Resource Allocation Algorithm in Distributed Wireless Ad Hoc Networks.,IEEE Access
Two-Timescale Resource Allocation for Wireless Powered D2D Communications With Self-Interested Nodes.,IEEE Access
Drift-Aware Methodology for Anomaly Detection in Smart Grid.,IEEE Access
Profiling Performance of Application Partitioning for Wearable Devices in Mobile Cloud and Fog Computing.,IEEE Access
On the Application of Massive MIMO Systems to Machine Type Communications.,IEEE Access
On Electromagnetic Radiation Control for Wireless Power Transfer in Adhoc Communication Networks - Key Issues and Challenges.,IEEE Access
On Improving Recovery Performance in Multiple Measurement Vector Having Dependency.,IEEE Access
A Review on Blockchain Technologies for an Advanced and Cyber-Resilient Automotive Industry.,IEEE Access
Dynamically Reconstructing Minimum Spanning Trees After Swapping Pairwise Vertices.,IEEE Access
Scene-Awareness Based Single Image Dehazing Technique via Automatic Estimation of Sky Area.,IEEE Access
Adaptive Neural-Based Finite-Time Trajectory Tracking Control for Underactuated Marine Surface Vessels With Position Error Constraint.,IEEE Access
Timing Channel in IaaS - How to Identify and Investigate.,IEEE Access
Big Production Enterprise Supply Chain Endogenous Risk Management Based on Blockchain.,IEEE Access
Depth-Based Human Detection Considering Postural Diversity and Depth Missing in Office Environment.,IEEE Access
When Time Matters - Predictive Mission Planning in Cyber-Physical Scenarios.,IEEE Access
Large-Scale Analysis of User Exposure to Online Advertising on Facebook.,IEEE Access
A Hybrid Model Based on Constraint OSELM, Adaptive Weighted SRC and KNN for Large-Scale Indoor Localization.,IEEE Access
Effect of Boundary Condition and Model Structure Integrity of Tooth-PDL-Bone Complex on Tooth Mode Computation.,IEEE Access
Wavelet Denoising Algorithm Based on NDOA Compressed Sensing for Fluorescence Image of Microarray.,IEEE Access
The Large-Small Group-Based Consensus Decision Method and Its Application to Teaching Management Problems.,IEEE Access
Image Denoising Based on HOSVD With Iterative-Based Adaptive Hard Threshold Coefficient Shrinkage.,IEEE Access
Diagnosis of Diabetic Retinopathy Using Deep Neural Networks.,IEEE Access
Info-Trust - A Multi-Criteria and Adaptive Trustworthiness Calculation Mechanism for Information Sources.,IEEE Access
Fixed-Time Attitude Tracking Control for Rigid Spacecraft With Actuator Misalignments and Faults.,IEEE Access
Fusion Image Based Radar Signal Feature Extraction and Modulation Recognition.,IEEE Access
Secure RFID Authentication Schemes Based on Security Analysis and Improvements of the USI Protocol.,IEEE Access
Single Image Super-Resolution Using Dual-Branch Convolutional Neural Network.,IEEE Access
Collaboration of Smart IoT Devices Exemplified With Smart Cupboards.,IEEE Access
Higher Order Sectorization in FFR-Aided OFDMA Cellular Networks - Spectral- and Energy-Efficiency.,IEEE Access
Stacked Denoising Extreme Learning Machine Autoencoder Based on Graph Embedding for Feature Representation.,IEEE Access
Robust Long-Term Spectrum Prediction With Missing Values and Sparse Anomalies.,IEEE Access
160-GHz Radar Proximity Sensor With Distributed and Flexible Antennas for Collaborative Robots.,IEEE Access
Toward High-Performance Implementation of 5G SCMA Algorithms.,IEEE Access
A Generic Spatiotemporal UAV Scheduling Framework for Multi-Event Applications.,IEEE Access
Towards a Knowledge-Based Recommender System for Linking Electronic Patient Records With Continuing Medical Education Information at the Point of Care.,IEEE Access
Low-Cost and Efficient Hardware Solution for Presentation Attack Detection in Fingerprint Biometrics Using Special Lighting Microscopes.,IEEE Access
High-Order Planar Bandpass Filters With Electronically-Reconfigurable Passband Width and Flatness Based on Adaptive Multi-Resonator Cascades.,IEEE Access
Using Transposition Padding to Get CCA2 Security From Any Deterministic Encryption Schemes.,IEEE Access
Intrinsic Image Sequence Decomposition Using Low-Rank Sparse Model.,IEEE Access
Adaptive Multivariable Control for Multiple Resource Allocation of Service-Based Systems in Cloud Computing.,IEEE Access
A Symbiotic Organisms Search Algorithm for Optimal Allocation of Blood Products.,IEEE Access
Real-Time Interference Identification via Supervised Learning - Embedding Coexistence Awareness in IoT Devices.,IEEE Access
Uncertainty-Aware Computational Tools for Power Distribution Networks Including Electrical Vehicle Charging and Load Profiles.,IEEE Access
Health and Safety Situation Awareness Model and Emergency Management Based on Multi-Sensor Signal Fusion.,IEEE Access
A Cooperation Analysis Method Using Internal and External Features for Mechanical and Electro-Hydraulic System.,IEEE Access
Deterministic Compressed Sensing Matrices From Sequences With Optimal Correlation.,IEEE Access
Achieving Semantic Secure Search in Cloud Supported Information-Centric Internet of Things.,IEEE Access
Deformable Cardiovascular Image Registration via Multi-Channel Convolutional Neural Network.,IEEE Access
Successive Cancellation Priority Decoding of Polar Codes.,IEEE Access
Effective Data Communication Based on Social Community in Social Opportunistic Networks.,IEEE Access
PCI Planning Based on Binary Quadratic Programming in LTE/LTE-A Networks.,IEEE Access
Improving Energy-Efficiency for Resource Allocation by Relay-Aided In-Band D2D Communications in C-RAN-Based Systems.,IEEE Access
3D Neuromorphic Wireless Power Transfer and Energy Transmission Based Synaptic Plasticity.,IEEE Access
Decentralized Trust Evaluation in Vehicular Internet of Things.,IEEE Access
Automatic Determination of Vertical Cup-to-Disc Ratio in Retinal Fundus Images for Glaucoma Screening.,IEEE Access
SDN-Based End-to-End Fragment-Aware Routing for Elastic Data Flows in LEO Satellite-Terrestrial Network.,IEEE Access
Indoor Localization Using Visible Light via Two-Layer Fusion Network.,IEEE Access
Radar HRRP Target Recognition Based on Deep One-Dimensional Residual-Inception Network.,IEEE Access
A Pipeline Neural Network for Low-Light Image Enhancement.,IEEE Access
Nonlinear Dynamic Surface Control for the Underactuated Translational Oscillator With Rotating Actuator System.,IEEE Access
Exploring Risk Factors With Crashes by Collision Type at Freeway Diverge Areas - Accounting for Unobserved Heterogeneity.,IEEE Access
Psychological Gender Express via Mobile Social Network Activities - An Experimental Study on a Gay Network Data.,IEEE Access
A Novel Miniaturized Planar Ultra-Wideband Antenna.,IEEE Access
Frequency Selection Approach for Energy Aware Cloud Database.,IEEE Access
Cold Start Recommendation Based on Attribute-Fused Singular Value Decomposition.,IEEE Access
Energy Optimization Algorithms for MIMO-OFDM Based Downlink C-RAN System.,IEEE Access
Fuzzy TOPSIS Approaches for Assessing the Intelligence Level of IoT-Based Tourist Attractions.,IEEE Access
A Single Attention-Based Combination of CNN and RNN for Relation Classification.,IEEE Access
On-Line Monitoring of Partial Discharge of Less-Oil Immersed Electric Equipment Based on Pressure and UHF.,IEEE Access
Performance of OnPrem Versus Azure SQL Server - A Case Study.,IEEE Access
Machine Learning Model for Adaptive Modulation of Multi-Stream in MIMO-OFDM System.,IEEE Access
An Integrated Methodology for Big Data Classification and Security for Improving Cloud Systems Data Mobility.,IEEE Access
3D Simulation Modeling of UAV-to-Car Communications.,IEEE Access
Fast Generation of Collision-Free Trajectories for Robot Swarms Using GPU Acceleration.,IEEE Access
Enhancement of the Duty Cycle Cooperative Medium Access Control for Wireless Body Area Networks.,IEEE Access
Green Coexistence for 5G Waveform Candidates - A Review.,IEEE Access
Dynamically Tunable Scattering Manipulation of Dielectric and Conducting Cylinders Using Nanostructured Graphene Metasurfaces.,IEEE Access
Multi-Label Learning With Label Specific Features Using Correlation Information.,IEEE Access
Multi-Objective Migrating Birds Optimization Algorithm for Stochastic Lot-Streaming Flow Shop Scheduling With Blocking.,IEEE Access
An Efficient Lucas Sequence-Based Batch Auditing Scheme for the Internet of Medical Things.,IEEE Access
Enhanced Deep Networks for Short-Term and Medium-Term Load Forecasting.,IEEE Access
General Reentry Trajectory Planning Method Based on Improved Maneuver Coefficient.,IEEE Access
Underdetermined Source Separation of Bearing Faults Based on Optimized Intrinsic Characteristic-Scale Decomposition and Local Non-Negative Matrix Factorization.,IEEE Access
DeepStar - Detecting Starring Characters in Movies.,IEEE Access
Asymmetric Loss Functions and Deep Densely-Connected Networks for Highly-Imbalanced Medical Image Segmentation - Application to Multiple Sclerosis Lesion Detection.,IEEE Access
Guaranteed Performance of Nonlinear Attitude Filters on the Special Orthogonal Group SO(3).,IEEE Access
Centroid Vectoring for Attitude Control of Floating Base Robots - From Maritime to Aerial Applications.,IEEE Access
Cache Aware User Association for Wireless Heterogeneous Networks.,IEEE Access
Testbed Evaluation of Real-Time Route Guidance in Inter-Vehicular Communication Urban Networks.,IEEE Access
Recent Advances in 3D Data Acquisition and Processing by Time-of-Flight Camera.,IEEE Access
Self-Organizing Approximation Command Filtered Backstepping Control for Higher Order SISO Systems in Internet of Things.,IEEE Access
Adaptive Covariance Feedback Cubature Kalman Filtering for Continuous-Discrete Bearings-Only Tracking System.,IEEE Access
STANN - A Spatio-Temporal Attentive Neural Network for Traffic Prediction.,IEEE Access
Reinvestigation of Single-Phase FLLs.,IEEE Access
Distributed LT Codes With Improved Error Floor Performance.,IEEE Access
Industries Return and Volatility Spillover in Chinese Stock Market - An Early Warning Signal of Systemic Risk.,IEEE Access
Collaborative Additional Variational Autoencoder for Top-N Recommender Systems.,IEEE Access
A New Algorithm for Blood Flow Measurement Based on the Doppler Flow Spectrogram.,IEEE Access
Measurement Data Fusion Based on Optimized Weighted Least-Squares Algorithm for Multi-Target Tracking.,IEEE Access
Dynamic Evolution Analysis of Metro Network Connectivity and Bottleneck Identification - From the Perspective of Individual Cognition.,IEEE Access
Double Layer Distributed Process Monitoring Based on Hierarchical Multi-Block Decomposition.,IEEE Access
Provable Data Integrity of Cloud Storage Service With Enhanced Security in the Internet of Things.,IEEE Access
Learning to Style-Aware Bayesian Personalized Ranking for Visual Recommendation.,IEEE Access
A Modified Gravitational Search Algorithm for Function Optimization.,IEEE Access
A Modified Deep Convolutional Neural Network for Abnormal Brain Image Classification.,IEEE Access
Review of Applications of Fuzzy Logic in Multi-Agent-Based Control System of AC-DC Hybrid Microgrid.,IEEE Access
Novel Multi-Material 3-Dimensional Low-Temperature Co-Fired Ceramic Base.,IEEE Access
Spectrum Occupancy Reconstruction in Distributed Cognitive Radio Networks Using Deep Learning.,IEEE Access
Collaborative Coexistence Management Scheme for Industrial Wireless Sensor Networks.,IEEE Access
Application of Big Data and Machine Learning in Smart Grid, and Associated Security Concerns - A Review.,IEEE Access
Fuzzy Sliding Mode Control for Systems With Matched and Mismatched Uncertainties/Disturbances Based on ENDOB.,IEEE Access
Stability of Switched Time-Delay Systems via Mode-Dependent Average Dwell Time Switching.,IEEE Access
Deep Hierarchical Network With Line Segment Learning for Quantitative Analysis of Facial Palsy.,IEEE Access
Random Drift Modeling and Compensation for MEMS-Based Gyroscopes and Its Application in Handwriting Trajectory Reconstruction.,IEEE Access
Direction of Arrival Estimation for Uniform Circular Array via &quot;Virtual Two-Dimensional Source Impinging on Virtual Multiple UCAs Equivalently&quot; in the Presence of Gain-Phase Errors.,IEEE Access
Improved Alpha-Guided Grey Wolf Optimizer.,IEEE Access
Periodic Charging for Wireless Sensor Networks With Multiple Portable Chargers.,IEEE Access
Green Energy Powered Cognitive Sensor Network With Cooperative Sensing.,IEEE Access
Minimizing Geo-Distributed Interactive Service Cost With Multiple Cloud Service Providers.,IEEE Access
Multiple Time Scales Analysis for Identifying Congestive Heart Failure Based on Heart Rate Variability.,IEEE Access
Passive Earth Pressures on Retaining Walls for Pit-in-Pit Excavations.,IEEE Access
Decentralized Real-Time Estimation and Tracking for Unknown Ground Moving Target Using UAVs.,IEEE Access
Joint CoMP Transmission for UAV-Aided Cognitive Satellite Terrestrial Networks.,IEEE Access
Image Encryption Using Josephus Problem and Filtering Diffusion.,IEEE Access
KST - Executable Formal Semantics of IEC 61131-3 Structured Text for Verification.,IEEE Access
Incorporating Importance Sampling in EM Learning for Sequence Detection in SPAD Underwater OWC.,IEEE Access
Rolling Bearing Performance Degradation Assessment Based on Convolutional Sparse Combination Learning.,IEEE Access
Root Cause Analysis of Traffic Anomalies Using Uneven Diffusion Model.,IEEE Access
Parameter Estimation of Delay-Doppler Underwater Acoustic Multi-Path Channel Based on Iterative Fractional Fourier Transform.,IEEE Access
Energy-Angle Domain Initial Access and Beam Tracking in Millimeter Wave V2X Communications.,IEEE Access
Innovative Human-Like Dual Robotic Hand Mechatronic Design and its Chess-Playing Experiment.,IEEE Access
On the Capacity of a Two-Hop Half-Duplex Relay Channel With a Markovian Constrained Relay.,IEEE Access
Research on Image Smoothing Diffusion Model With Gradient and Curvature Features.,IEEE Access
Frequency Hopping and Parallel Driving With Random Delay Especially Suitable for the Charger Noise Problem in Mutual-Capacitive Touch Applications.,IEEE Access
Learning Robust Embedding Representation With Hybrid Loss for Classification and Verification.,IEEE Access
Multi-Objective Optimization Control of Distributed Electric Drive Vehicles Based on Optimal Torque Distribution.,IEEE Access
Minimum Neighborhood of Alternating Group Graphs.,IEEE Access
Deep Decoupling Convolutional Neural Network for Intelligent Compound Fault Diagnosis.,IEEE Access
Brain Image Segmentation Based on FCM Clustering Algorithm and Rough Set.,IEEE Access
An Autonomous Developmental Cognitive Architecture Based on Incremental Associative Neural Network With Dynamic Audiovisual Fusion.,IEEE Access
Ground-Based Radar Detection for High-Speed Maneuvering Target via Fast Discrete Chirp-Fourier Transform.,IEEE Access
Stochastic Security Assessment for Power Systems With High Renewable Energy Penetration Considering Frequency Regulation.,IEEE Access
An Adaptive Mechanism for Recommendation Algorithm Ensemble.,IEEE Access
Unsupervised Learning-Based Fast Beamforming Design for Downlink MIMO.,IEEE Access
RBFNN-Based Adaptive Sliding Mode Control Design for Nonlinear Bilateral Teleoperation System Under Time-Varying Delays.,IEEE Access
Texture Feature Extraction Methods - A Survey.,IEEE Access
Analysis of Facebook Interaction as Basis for Synthetic Expanded Social Graph Generation.,IEEE Access
A New Bearing Fault Diagnosis Method Based on Fine-to-Coarse Multiscale Permutation Entropy, Laplacian Score and SVM.,IEEE Access
A New Recommendation Approach Based on Probabilistic Soft Clustering Methods - A Scientific Documentation Case Study.,IEEE Access
Applying Bayesian Network Approach to Determine the Association Between Morphological Features Extracted from Prostate Cancer Images.,IEEE Access
Impact of Uncertainties on Resilient Operation of Microgrids - A Data-Driven Approach.,IEEE Access
Spectral Efficient Spatial Modulation Techniques.,IEEE Access
Locally Statistical Dual-Mode Background Subtraction Approach.,IEEE Access
Ontology-Based Personalized Course Recommendation Framework.,IEEE Access
A Prediction Approach for Stock Market Volatility Based on Time Series Data.,IEEE Access
Geometrical Variation&apos;s Influence on the Effects of Stimulation May be Important in the Conventional and Multi-Array tDCS-Comparison of Electrical Fields Computed.,IEEE Access
DQ-Voltage Droop Control and Robust Secondary Restoration With Eligibility to Operate During Communication Failure in Autonomous Microgrid.,IEEE Access
A Hybrid Framework for Sentiment Analysis Using Genetic Algorithm Based Feature Reduction.,IEEE Access
A Pattern-Based Academic Reviewer Recommendation Combining Author-Paper and Diversity Metrics.,IEEE Access
ICT in Higher Education - An Exploration of Practices in Malaysian Universities.,IEEE Access
An Overview on Concept Drift Learning.,IEEE Access
In-Band Full-Duplex Relay-Assisted Millimeter-Wave System Design.,IEEE Access
Evolutionary 4G/5G Network Architecture Assisted Efficient Handover Signaling.,IEEE Access
Evolutionary Optimization Using Equitable Fuzzy Sorting Genetic Algorithm (EFSGA).,IEEE Access
Modulation Options for OFDM-Based Waveforms - Classification, Comparison, and Future Directions.,IEEE Access
Feature Learning and Analysis for Cleanliness Classification in Restrooms.,IEEE Access
Utilizing Multiple-Access Communication to Realize FNN Computation in Wireless Networks.,IEEE Access
Time-Energy Optimal Trajectory Planning for Variable Stiffness Actuated Robot.,IEEE Access
Speech Enhancement Based on Dictionary Learning and Low-Rank Matrix Decomposition.,IEEE Access
Retrieval of Ionospheric Faraday Rotation Angle in Low-Frequency Polarimetric SAR Data.,IEEE Access
EEG Processing in Internet of Medical Things Using Non-Harmonic Analysis - Application and Evolution for SSVEP Responses.,IEEE Access
Cross-Tier Dual-Connectivity Designs of Three-Tier Hetnets With Decoupled Uplink/Downlink and Global Coverage Performance Evaluation.,IEEE Access
Category Theory-Based Mobile User Interface Pattern Recommendation Method.,IEEE Access
A Rotating Machinery Fault Diagnosis Method Based on Feature Learning of Thermal Images.,IEEE Access
High-Gain Fabry-Perot Antennas With Wideband Low Monostatic RCS Using Phase Gradient Metasurface.,IEEE Access
Research on Scene Understanding-Based Encrypted Image Retrieval Algorithm.,IEEE Access
Joint Multiple Sources Localization Using TOA Measurements Based on Lagrange Programming Neural Network.,IEEE Access
Short-Term Demand Prediction Method for Online Car-Hailing Services Based on a Least Squares Support Vector Machine.,IEEE Access
An End-to-End Human Segmentation by Region Proposed Fully Convolutional Network.,IEEE Access
Flexible Filter Bank Multi-Carriers PON Based on Two-Dimensional Multiple Probabilistic Shaping Distribution.,IEEE Access
Parallel Processing of Probabilistic Models-Based Power Supply Unit Mid-Term Load Forecasting With Apache Spark.,IEEE Access
An Efficient Fault Diagnostic Method for Three-Phase Induction Motors Based on Incremental Broad Learning and Non-Negative Matrix Factorization.,IEEE Access
Multi-Label Metric Transfer Learning Jointly Considering Instance Space and Label Space Distribution Divergence.,IEEE Access
A Connecting Timetable Rescheduling Model for Production and Rail Transportation With Unexpected Disruptions.,IEEE Access
Prediction of SNP Sequences via Gini Impurity Based Gradient Boosting Method.,IEEE Access
Projective Latent Dependency Forest Models.,IEEE Access
Cloud Types Identification for Meteorological Satellite Image Using Multiple Sparse Representation Classifiers via Decision Fusion.,IEEE Access
On Modified Multi-Output Chebyshev-Polynomial Feed-Forward Neural Network for Pattern Classification of Wine Regions.,IEEE Access
Process Planning Optimization With Energy Consumption Reduction From a Novel Perspective - Mathematical Modeling and a Dynamic Programming-Like Heuristic Algorithm.,IEEE Access
QFM Signals Parameters Estimation Based on Double Scale Two Dimensional Frequency Distribution.,IEEE Access
Design of an Internet of Brain Things Network Security System Based on ICN.,IEEE Access
Segmentation of the Main Vessel of the Left Anterior Descending Artery Using Selective Feature Mapping in Coronary Angiography.,IEEE Access
Remote Sensing Image Haze Removal Using Gamma-Correction-Based Dehazing Model.,IEEE Access
Diagnosing Metabolic Syndrome Using Genetically Optimised Bayesian ARTMAP.,IEEE Access
Exploring Object-Centric and Scene-Centric CNN Features and Their Complementarity for Human Rights Violations Recognition in Images.,IEEE Access
Power- and Time-Aware Deep Learning Inference for Mobile Embedded Devices.,IEEE Access
Input-to-State Stabilization of Uncertain Parabolic PDEs Using an Observer-Based Fuzzy Control.,IEEE Access
Deep Learning-Based Sustainable Data Center Energy Cost Minimization With Temporal MACRO/MICRO Scale Management.,IEEE Access
CPW Fed Wideband Corner Bent Antenna for 5G Mobile Terminals.,IEEE Access
Non-Orthogonal Multiplexing of Ultra-Reliable and Broadband Services in Fog-Radio Architectures.,IEEE Access
Adaptive Independent Subspace Analysis of Brain Magnetic Resonance Imaging Data.,IEEE Access
